"Authors","Author full names","Author(s) ID","Title","Year","Source title","Volume","Issue","Art. No.","Page start","Page end","Page count","Cited by","DOI","Link","Author Keywords","Index Keywords","Document Type","Publication Stage","Open Access","Source","EID"
"Silva-Carvalho A.É.; Oliveira N.N.D.; Machado J.V.L.; Moreira D.C.; Brand G.D.; Leite J.R.S.A.; Plácido A.; Eaton P.; Saldanha-Araujo F.","Silva-Carvalho, Amandda Évelin (57204085906); Oliveira, Nakaly Natiely de (58515332500); Machado, Julia Viana Lafetá (58514204600); Moreira, Daniel Carneiro (55308326300); Brand, Guilherme Dotto (8639196800); Leite, José Roberto S. A. (7201818308); Plácido, Alexandra (55232677900); Eaton, Peter (7005831154); Saldanha-Araujo, Felipe (25026388400)","57204085906; 58515332500; 58514204600; 55308326300; 8639196800; 7201818308; 55232677900; 7005831154; 25026388400","The Peptide Salamandrin-I Modulates Components Involved in Pyroptosis and Induces Cell Death in Human Leukemia Cell Line HL-60","2023","Pharmaceutics","15","7","1864","","","","0","10.3390/pharmaceutics15071864","https://www.scopus.com/inward/record.uri?eid=2-s2.0-85166343272&doi=10.3390%2fpharmaceutics15071864&partnerID=40&md5=b823a85e8e0accae3e420b1dcbcad34c","antioxidant peptide; HL-60; leukemia; pyroptosis; salamandrin-I","antimitotic agent; cryopyrin; inflammasome; interleukin 1beta; interleukin 1beta converting enzyme; lactate dehydrogenase; salamandrin I; unclassified drug; antiproliferative activity; Article; cell proliferation; cell viability; controlled study; cytotoxicity; drug determination; drug effect; enzyme activation; enzyme release; G2 phase cell cycle checkpoint; gene expression profiling; HL-60 cell line; human; human cell; mitochondrial membrane potential; protein expression; pyroptosis","Article","Final","All Open Access; Gold Open Access; Green Open Access","Scopus","2-s2.0-85166343272"
"Dematei A.; Costa S.R.; Moreira D.C.; Barbosa E.A.; Friaça Albuquerque L.F.; Vasconcelos A.G.; Nascimento T.; Silva P.C.; Silva-Carvalho A.É.; Saldanha-Araújo F.; Silva Mancini M.C.; Saboia Ponte L.G.; Neves Bezerra R.M.; Simabuco F.M.; Batagin-Neto A.; Brand G.; Borges T.K.S.; Eaton P.; Leite J.R.S.A.","Dematei, Anderson (57195954021); Costa, Samuel Ribeiro (58010475400); Moreira, Daniel C. (55308326300); Barbosa, Eder Alves (14044592700); Friaça Albuquerque, Lucas F. (58010571200); Vasconcelos, Andreanne G. (57055189300); Nascimento, Tiago (58010005000); Silva, Pedro Costa (58010571300); Silva-Carvalho, Amandda É. (57204085906); Saldanha-Araújo, Felipe (25026388400); Silva Mancini, Mariana Camargo (57412741200); Saboia Ponte, Luis Gustavo (58010096300); Neves Bezerra, Rosangela Maria (57218491549); Simabuco, Fernando Moreira (15926246800); Batagin-Neto, Augusto (15069371100); Brand, Guilherme (8639196800); Borges, Tatiana Karla S. (56465595400); Eaton, Peter (7005831154); Leite, José Roberto S. A. (7201818308)","57195954021; 58010475400; 55308326300; 14044592700; 58010571200; 57055189300; 58010005000; 58010571300; 57204085906; 25026388400; 57412741200; 58010096300; 57218491549; 15926246800; 15069371100; 8639196800; 56465595400; 7005831154; 7201818308","Antioxidant and Neuroprotective Effects of the First Tryptophyllin Found in Snake Venom (Bothrops moojeni)","2022","Journal of Natural Products","85","12","","2695","2705","10","1","10.1021/acs.jnatprod.2c00304","https://www.scopus.com/inward/record.uri?eid=2-s2.0-85143988068&doi=10.1021%2facs.jnatprod.2c00304&partnerID=40&md5=236b408ceb233ef7429e5f64daf4d33e","","Animals; Antioxidants; Bothrops; Crotalid Venoms; Humans; Neuroblastoma; Neuroprotective Agents; Peptides; Snake Venoms; alpha tocopherol; antioxidant; aromatic compound; arsenic trioxide; ascorbic acid; bmt 2; carnosine; DNA; fluorescein; free radical; glutathione; glycylhistidyllysine; melatonin; neuroprotective agent; peptide; phorbol 13 acetate 12 myristate; reactive nitrogen species; reactive oxygen metabolite; salamandrin I; snake venom; transcription factor Nrf2; trolox C; tryptophyllin; unclassified drug; 2,2'-azobis(2-amidinopropane); antioxidant; neuroprotective agent; peptide; snake venom; ABTS radical scavenging assay; antioxidant activity; Article; Bothrops; Bothrops moojeni; cell viability; computer model; controlled study; drug cytotoxicity; drug isolation; drug structure; drug synthesis; erythrocyte; hemolysis; high performance liquid chromatography; human; human cell; in vitro study; matrix assisted laser desorption ionization time of flight mass spectrometry; molecular dynamics; Neuro-2a cell line; neuroprotection; ORAC assay; oxidative stress; peptide synthesis; SK-N-BE(2) cell line; upregulation; animal; chemistry; neuroblastoma","Article","Final","","Scopus","2-s2.0-85143988068"
"Moreira D.C.; Carvajalino-Fernández J.M.; Navas C.A.; de Carvalho J.E.; Hermes-Lima M.","Moreira, Daniel C. (55308326300); Carvajalino-Fernández, Juan M. (55909349600); Navas, Carlos A. (7003298478); de Carvalho, José E. (57221938300); Hermes-Lima, Marcelo (7003603863)","55308326300; 55909349600; 7003298478; 57221938300; 7003603863","Metabolic and Redox Biomarkers in Skeletal Muscle Underlie Physiological Adaptations of Two Estivating Anuran Species in a South American Semi-arid Environment","2021","Frontiers in Physiology","12","","769833","","","","3","10.3389/fphys.2021.769833","https://www.scopus.com/inward/record.uri?eid=2-s2.0-85121695293&doi=10.3389%2ffphys.2021.769833&partnerID=40&md5=aaaefc0b29ff2b391737f3afcf049f68","amphibia; antioxidant; Caatinga; glutathione; Pleurodema diplolister; preparation for oxidative stress; Proceratophrys cristiceps; reactive oxygen species","biological marker; carbonyl derivative; catalase; citrate synthase; creatine kinase; glutathione; glutathione disulfide; glutathione peroxidase; glutathione transferase; isocitrate dehydrogenase; malate dehydrogenase (decarboxylating); aerobic metabolism; aestivation; Anura; Article; dry season; enzyme activity; metabolic regulation; microhabitat; muscle function; muscle metabolism; nonhuman; oxidation reduction state; oxidative stress; phylogeny; Pleurodema diplolister; Proceratophrys cristiceps; rainy season; semiarid climate; skeletal muscle; species comparison; survival; temperature acclimatization","Article","Final","All Open Access; Gold Open Access; Green Open Access","Scopus","2-s2.0-85121695293"
"Moreira D.C.; Paula D.P.; Hermes-Lima M.","Moreira, Daniel C. (55308326300); Paula, Débora P. (55776212600); Hermes-Lima, Marcelo (7003603863)","55308326300; 55776212600; 7003603863","Changes in metabolism and antioxidant systems during tropical diapause in the sunflower caterpillar Chlosyne lacinia (Lepidoptera: Nymphalidae)","2021","Insect Biochemistry and Molecular Biology","134","","103581","","","","2","10.1016/j.ibmb.2021.103581","https://www.scopus.com/inward/record.uri?eid=2-s2.0-85104917379&doi=10.1016%2fj.ibmb.2021.103581&partnerID=40&md5=797e080b2e6f1e249ab4a4b40b6f4ab4","Glutathione; Glutathione transferase; Isocitrate dehydrogenase; Metabolic depression; NADPH; Preparation for oxidative stress","Animals; Antioxidants; Butterflies; Diapause, Insect; Glutathione; Glutathione Transferase; Insect Proteins; Larva; NADP; Oxidative Stress; antioxidant; glutathione; glutathione transferase; insect protein; nicotinamide adenine dinucleotide phosphate; animal; butterfly; diapause; larva; metabolism; oxidative stress; physiology","Article","Final","","Scopus","2-s2.0-85104917379"
"Almeida R.M.V.R.; Borges L.F.F.; Moreira D.C.; Hermes-Lima M.","Almeida, Renan Moritz V. R. (7102385818); Borges, Luis Fabiano F. (58718159700); Moreira, Daniel C. (55308326300); Hermes-Lima, Marcelo (7003603863)","7102385818; 58718159700; 55308326300; 7003603863","New Metrics for Cross-Country Comparison of Scientific Impact","2020","Frontiers in Research Metrics and Analytics","5","","594891","","","","0","10.3389/frma.2020.594891","https://www.scopus.com/inward/record.uri?eid=2-s2.0-85177746624&doi=10.3389%2ffrma.2020.594891&partnerID=40&md5=58970953c141bb001de4531ec4db574b","citations per publication; h-index; performance metrics; science impact; scientific productivity","","Article","Final","All Open Access; Gold Open Access; Green Open Access","Scopus","2-s2.0-85177746624"
