"Authors","Author full names","Author(s) ID","Title","Year","Source title","Volume","Issue","Art. No.","Page start","Page end","Page count","Cited by","DOI","Link","Abstract","Author Keywords","Index Keywords","Document Type","Publication Stage","Open Access","Source","EID"
"Plácido A.; do Pais do Amaral C.; Teixeira C.; Nogueira A.; Brango-Vanegas J.; Alves Barbosa E.; C. Moreira D.; Silva-Carvalho A.É.; da Silva M.D.G.; do Nascimento Dias J.; Albuquerque P.; Saldanha-Araújo F.; C. D. A. Lima F.; Batagin-Neto A.; Kuckelhaus S.; Bessa L.; Freitas J.; Dotto Brand G.; C. Santos N.; B. Relvas J.; Gomes P.; S. A. Leite J.R.; Eaton P.","Plácido, Alexandra (55232677900); do Pais do Amaral, Constança (57615417600); Teixeira, Cátia (23981482200); Nogueira, Ariane (57611450200); Brango-Vanegas, José (56029877500); Alves Barbosa, Eder (57215687534); C. Moreira, Daniel (55308326300); Silva-Carvalho, Amandda É. (57204085906); da Silva, Maria da Gloria (57219848293); do Nascimento Dias, Jhones (57211714718); Albuquerque, Patrícia (14526846200); Saldanha-Araújo, Felipe (25026388400); C. D. A. Lima, Filipe (57613452700); Batagin-Neto, Augusto (15069371100); Kuckelhaus, Selma (8313515500); Bessa, Lucinda J. (37092470400); Freitas, Jaime (57204348265); Dotto Brand, Guilherme (8639196800); C. Santos, Nuno (55940818300); B. Relvas, João (57611450300); Gomes, Paula (7102879822); S. A. Leite, José Roberto (7201818325); Eaton, Peter (7005831154)","55232677900; 57615417600; 23981482200; 57611450200; 56029877500; 57215687534; 55308326300; 57204085906; 57219848293; 57211714718; 14526846200; 25026388400; 57613452700; 15069371100; 8313515500; 37092470400; 57204348265; 8639196800; 55940818300; 57611450300; 7102879822; 7201818325; 7005831154","Neuroprotective effects on microglia and insights into the structure–activity relationship of an antioxidant peptide isolated from Pelophylax perezi","2022","Journal of Cellular and Molecular Medicine","26","10","","2793","2807","14","10","10.1111/jcmm.17292","https://www.scopus.com/inward/record.uri?eid=2-s2.0-85128779284&doi=10.1111%2fjcmm.17292&partnerID=40&md5=ab7444d2ae5c1985bc9f29d4ff149b99","Tryptophyllins constitute a heterogeneous group of peptides that are one of the first classes of peptides identified from amphibian’s skin secretions. Here, we report the structural characterization and antioxidant properties of a novel tryptophyllin-like peptide, named PpT-2, isolated from the Iberian green frog Pelophylax perezi. The skin secretion of P. perezi was obtained by electrical stimulation and fractionated using RP-HPLC. De novo peptide sequencing was conducted using MALDI MS/MS. The primary structure of PpT-2 (FPWLLS-NH2) was confirmed by Edman degradation and subsequently investigated using in silico tools. PpT-2 shared physicochemical properties with other well-known antioxidants. To test PpT-2 for antioxidant activity in vitro, the peptide was synthesized by solid phase and assessed in the chemical-based ABTS and DPPH scavenging assays. Then, a flow cytometry experiment was conducted to assess PpT-2 antioxidant activity in oxidatively challenged murine microglial cells. As predicted by the in silico analyses, PpT-2 scavenged free radicals in vitro and suppressed the generation of reactive species in PMA-stimulated BV-2 microglia cells. We further explored possible bioactivities of PpT-2 against prostate cancer cells and bacteria, against which the peptide exerted a moderate antiproliferative effect and negligible antimicrobial activity. The biocompatibility of PpT-2 was evaluated in cytotoxicity assays and in vivo toxicity with Galleria mellonella. No toxicity was detected in cells treated with up to 512 µg/ml and in G. mellonella treated with up to 40 mg/kg PpT-2. This novel peptide, PpT-2, stands as a promising peptide with potential therapeutic and biotechnological applications, mainly for the treatment/prevention of neurodegenerative disorders. © 2022 The Authors. Journal of Cellular and Molecular Medicine published by Foundation for Cellular and Molecular Medicine and John Wiley & Sons Ltd.","Amphibia; antioxidant; bioactive peptide; neuroprotection; Pelophylax perezi; tryptophyllin","antioxidant; edetic acid; peptide; phosphate buffered saline; potassium salt; reactive oxygen metabolite; tryptophyllin like peptide; unclassified drug; ABTS radical scavenging assay; animal cell; Article; biological activity; BV-2 cell line; cell proliferation; cis- trans isomerization; controlled study; cytotoxicity assay; De novo peptide sequencing; electrostimulation; Enterococcus faecalis; Escherichia coli; flow cytometry; Galleria mellonella; hemolysis; hemolysis assay; high performance liquid chromatography; human; human cell; hydroxyl radical scavenging assay; in vivo study; isoelectric point; isomerization; mass spectrometry; matrix-assisted laser desorption-ionization mass spectrometry; microglia; minimum inhibitory concentration; nerve stimulation; neuroprotection; nonhuman; oxidative stress; Pelophylax perezi; peptide synthesis; Pseudomonas aeruginosa; purification; reversed phase high performance liquid chromatography; sequence analysis; skin pigmentation; skin secretion; solid phase peptide synthesis; Staphylococcus aureus; structure activity relation; tryptophyllin","Article","Final","All Open Access; Green Open Access","Scopus","2-s2.0-85128779284"
"Santos B.W.L.; Moreira D.C.; Borges T.K.S.; Caldas E.D.","Santos, Beatriz Werneck Lopes (57034894400); Moreira, Daniel Carneiro (55308326300); Borges, Tatiana Karla Dos Santos (56465595400); Caldas, Eloisa Dutra (6701392562)","57034894400; 55308326300; 56465595400; 6701392562","Components of Banisteriopsis caapi, a Plant Used in the Preparation of the Psychoactive Ayahuasca, Induce Anti-Inflammatory Effects in Microglial Cells","2022","Molecules","27","8","2500","","","","5","10.3390/molecules27082500","https://www.scopus.com/inward/record.uri?eid=2-s2.0-85129048016&doi=10.3390%2fmolecules27082500&partnerID=40&md5=9e7a1ed75d15d021ab01dcbe5c06aeb4","Banisteriopsis caapi is used to prepare the psychoactive beverage ayahuasca, and both have therapeutic potential for the treatment of many central nervous system (CNS) conditions. This study aimed to isolate new bioactive compounds from B. caapi extract and evaluate their biological activity, and that of the known β-carboline components of the plant (harmine, harmaline, and tetrahydroharmine), in BV-2 microglial cells, the in vivo activation of which is implicated in the physiopathology of CNS disorders. B. caapi extract was fractionated using semipreparative liquid chromatography (HPLC-DAD) and the exact masses ([M + H]+ m/z) of the compounds in the 5 isolated fractions were determined by high-resolution LC-MS/MS: F1 (174.0918 and 233.1289), F2 (353.1722), F3 (304.3001), F4 (188.1081), and F5 (205.0785). Harmine (75.5–302 µM) significantly decreased cell viability after 2 h of treatment and increased the number of necrotic cells and production of reactive oxygen species at equal or lower concentrations after 24 h. F4 did not impact viability but was also cytotoxic after 24 h. Most treatments reduced proinflammatory cytokine production (IL-2, IL-6, IL-17, and/or TNF), especially harmaline and F5 at 2.5 µM and higher concentrations, tetrahydroharmine (9.3 µM and higher), and F5 (10.7 µM and higher). The results suggest that the compounds found in B. caapi extract have anti-inflammatory potential that could be explored for the development of treatments for neurodegenerative diseases. © 2022 by the authors. Licensee MDPI, Basel, Switzerland.","ayahuasca; Banisteriopsis caapi; BV-2 microglial cells; cytokines; reactive oxygen species; ß-carbolines","","Article","Final","All Open Access; Gold Open Access; Green Open Access","Scopus","2-s2.0-85129048016"
"Moreira D.C.; Batagin-Neto A.; Leite J.R.S.A.","Moreira, Daniel C. (55308326300); Batagin-Neto, Augusto (15069371100); Leite, José Roberto S.A. (7201818325)","55308326300; 15069371100; 7201818325","Frog-derived peptides and neuroprotection","2024","Natural Molecules in Neuroprotection and Neurotoxicity","","","","415","436","21","0","10.1016/B978-0-443-23763-8.00018-X","https://www.scopus.com/inward/record.uri?eid=2-s2.0-85192338126&doi=10.1016%2fB978-0-443-23763-8.00018-X&partnerID=40&md5=e8cfc44ff935f6c01fab1589c634d3d2","The incidence of age-related diseases (e.g., neurodegenerative diseases) is increasing as the world’s population lives longer. Neurodegeneration, the dysfunction and loss of neurons, is a hallmark of chronic (e.g., Alzheimer’s disease and Parkinson’s disease) and acute (e.g., stroke) pathological conditions for which current treatment is less than ideal. This has motivated the search for novel therapeutic agents, including peptide drugs. In the last years, peptides found in the skin secretion of amphibians have shown neuroprotective activity under experimental conditions. This chapter provides an overview of the studies that have investigated the neuroprotective potential of peptides isolated from the skin secretion of anurans. Six peptides, including two ocellatins and two tryptophyllins, originally found in the skin secretion of five anuran species are covered. The evidence for the neuroprotective activity of these peptides mainly stems from their ability to modulate microglia activation and the redox metabolism, key therapeutic targets for treatment of neurodegeneration. Other targets, such as mitogen-activated protein kinase-related signaling components, have also been investigated. Despite the necessity of further studies to elucidate the underlying mechanisms of action, as well as their pharmacokinetics and pharmacodynamics, peptides from the skin secretion of anurans hold promise as therapeutic agents for neurodegenerative diseases. © 2024 Elsevier Inc. All rights reserved.","Antioxidant; hypoxia; ischemia; microglia; neurodegeneration; oxidative stress","","Book chapter","Final","","Scopus","2-s2.0-85192338126"
"Giraud-Billoud M.; Rivera-Ingraham G.A.; Moreira D.C.; Burmester T.; Castro-Vazquez A.; Carvajalino-Fernández J.M.; Dafre A.; Niu C.; Tremblay N.; Paital B.; Rosa R.; Storey J.M.; Vega I.A.; Zhang W.; Yepiz-Plascencia G.; Zenteno-Savin T.; Storey K.B.; Hermes-Lima M.","Giraud-Billoud, Maximiliano (24491821500); Rivera-Ingraham, Georgina A. (24512535400); Moreira, Daniel C. (55308326300); Burmester, Thorsten (56265321100); Castro-Vazquez, Alfredo (55981267400); Carvajalino-Fernández, Juan M. (55909349600); Dafre, Alcir (23492058500); Niu, Cuijuan (7102313514); Tremblay, Nelly (35197212700); Paital, Biswaranjan (23985596400); Rosa, Rui (7102610088); Storey, Janet M. (57204569242); Vega, Israel A. (6701447521); Zhang, Wenyi (55775749500); Yepiz-Plascencia, Gloria (7003846278); Zenteno-Savin, Tania (6602620228); Storey, Kenneth B. (57203234033); Hermes-Lima, Marcelo (7003603863)","24491821500; 24512535400; 55308326300; 56265321100; 55981267400; 55909349600; 23492058500; 7102313514; 35197212700; 23985596400; 7102610088; 57204569242; 6701447521; 55775749500; 7003846278; 6602620228; 57203234033; 7003603863","Twenty years of the ‘Preparation for Oxidative Stress’ (POS) theory: Ecophysiological advantages and molecular strategies","2019","Comparative Biochemistry and Physiology -Part A : Molecular and Integrative Physiology","234","","","36","49","13","95","10.1016/j.cbpa.2019.04.004","https://www.scopus.com/inward/record.uri?eid=2-s2.0-85064690836&doi=10.1016%2fj.cbpa.2019.04.004&partnerID=40&md5=3ec27f9d52b85098629762d9a02ea91c","Freezing, dehydration, salinity variations, hypoxia or anoxia are some of the environmental constraints that many organisms must frequently endure. Organisms adapted to these stressors often reduce their metabolic rates to maximize their chances of survival. However, upon recovery of environmental conditions and basal metabolic rates, cells are affected by an oxidative burst that, if uncontrolled, leads to (oxidative) cell damage and eventually death. Thus, a number of adapted organisms are able to increase their antioxidant defenses during an environmental/functional hypoxic transgression; a strategy that was interpreted in the 1990s as a “preparation for oxidative stress” (POS). Since that time, POS mechanisms have been identified in at least 83 animal species representing different phyla including Cnidaria, Nematoda, Annelida, Tardigrada, Echinodermata, Arthropoda, Mollusca and Chordata. Coinciding with the 20th anniversary of the postulation of the POS hypothesis, we compiled this review where we analyze a selection of examples of species showing POS-mechanisms and review the most recent advances in understanding the underlying molecular mechanisms behind those strategies that allow animals to survive in harsh environments. © 2019 Elsevier Inc.","Aerial exposure; Dehydration; Estivation; Freezing; Hibernation; Hypoxia; Salinity stress","Adaptation, Physiological; Animals; Annelida; Dehydration; Evolution, Molecular; Freezing; Hypoxia; Mollusca; Oxidative Stress; Salinity; enzyme; microRNA; transcription factor; adaptation; aestivation; animal model; anoxia; benthos; cold tolerance; ecophysiology; environmental exposure; environmental factor; environmental stress; environmental temperature; epigenetics; estuarine species; freezing; hibernation; hypoxia; intertidal species; nonhuman; oxidative stress; pelagic species; plankton; protein processing; regulatory mechanism; Review; RNA translation; salt stress; adverse event; animal; annelid; dehydration; genetics; hypoxia; metabolism; molecular evolution; mollusc; oxidative stress; physiology; salinity","Review","Final","","Scopus","2-s2.0-85064690836"
"Moreira D.C.; Carvajalino-Fernández J.M.; Silva W.P.; Kuzniewski F.; Navas C.A.; de Carvalho J.E.; Hermes-Lima M.","Moreira, Daniel C. (55308326300); Carvajalino-Fernández, Juan M. (55909349600); Silva, Willianilson P. (57215858466); Kuzniewski, Felipe (57215857648); Navas, Carlos A. (7003298478); de Carvalho, José E. (7202738697); Hermes-Lima, Marcelo (7003603863)","55308326300; 55909349600; 57215858466; 57215857648; 7003298478; 7202738697; 7003603863","Preparation for oxidative stress in Proceratophrys cristiceps (Anura, Odontophrynidae) naturally estivating in the Brazilian Caatinga","2020","Science of the Total Environment","723","","137957","","","","11","10.1016/j.scitotenv.2020.137957","https://www.scopus.com/inward/record.uri?eid=2-s2.0-85082102573&doi=10.1016%2fj.scitotenv.2020.137957&partnerID=40&md5=a20157fec31f72caeb24852e56ea7bf9","Preparation for oxidative stress (POS), i.e., the buildup of endogenous antioxidants during metabolic depression or low oxygen stress conditions, has been observed in at least 8 animal phyla under controlled conditions in laboratory. Despite the expected implications on the endurance to extreme environments and ecosystem occupation, the extent to which POS occurs in animals under natural conditions remains unexplored. Therefore, we took advantage of the natural history of the Brazilian Caatinga's frog Proceratophrys cristiceps to investigate the modulation of endogenous antioxidants and redox balance in their skeletal muscle and to verify if POS occurs under natural conditions. Expectedly, estivating frogs had low levels of the oxidative metabolism enzymes. Citrate synthase and isocitrate dehydrogenase activities were 36% and 25% lower than those in active frogs respectively. We found an overall upregulation of antioxidants in estivating P. cristiceps. Reduced glutathione concentration was 61% higher in estivating frogs than that in active animals. During estivation the activities of the hydroperoxide detoxification enzymes catalase, glutathione peroxidase, and glutathione H2O2-peroxidase were 48%, 57%, and 78% greater than those during the rainy season. Moreover, estivating frogs had a 47% lower ratio of disulfide to total glutathione levels than active frogs. Our findings confirm the occurrence of ‘preparation for oxidative stress’ in naturally estivating frogs and paves the way for further research on the redox biology of animals under natural settings. Such approach might reveal biochemical strategies under ecologically relevant scenarios. © 2020 Elsevier B.V.","Anuran; Caatinga; Glutathione; Metabolic depression; Reactive oxygen species; Redox balance","Animals; Antioxidants; Anura; Brazil; Ecosystem; Glutathione; Hydrogen Peroxide; Oxidative Stress; Brazil; Animalia; Anura; Proceratophrys cristiceps; Animals; Antioxidants; Detoxification; Enzymes; Metabolism; Muscle; Oxidative stress; Reactive oxygen species; Sulfur compounds; catalase; citrate synthase; glutathione; glutathione peroxidase; isocitrate dehydrogenase; antioxidant; glutathione; hydrogen peroxide; Anuran; Caatinga; Glutathiones; Metabolic depression; Redox balances; antioxidant; enzyme activity; frog; metabolism; oxidative stress; reactive oxygen species; redox conditions; aerobic metabolism; aestivation; Anura; Article; controlled study; detoxification; enzyme activity; enzyme metabolism; microhabitat; nonhuman; oxidation reduction reaction; oxidative stress; priority journal; Proceratophrys cristiceps; rainy season; upregulation; animal; Anura; Brazil; ecosystem; oxidative stress; Peptides","Article","Final","","Scopus","2-s2.0-85082102573"
"Moreira D.C.; Oliveira M.F.; Liz-Guimarães L.; Diniz-Rojas N.; Campos É.G.; Hermes-Lima M.","Moreira, Daniel C. (55308326300); Oliveira, Marcus F. (7402586578); Liz-Guimarães, Lara (57195916236); Diniz-Rojas, Nilda (57195919495); Campos, Élida G. (56234121700); Hermes-Lima, Marcelo (7003603863)","55308326300; 7402586578; 57195916236; 57195919495; 56234121700; 7003603863","Corrigendum: Current trends and research challenges regarding ""preparation for oxidative stress"" [Front. Physiol., 8, (2017), (702)] doi: 10.3389/fphys.2017.00702","2018","Frontiers in Physiology","9","JUL","950","","","","0","10.3389/fphys.2018.00950","https://www.scopus.com/inward/record.uri?eid=2-s2.0-85049863923&doi=10.3389%2ffphys.2018.00950&partnerID=40&md5=0d4bc498d50679cf0c74c2a6922f391d","Several biochemical adaptations, including metabolic depression, use of anaerobic pathways, epigenetic modifications, and changes in redox metabolism are conserved among many animal species that tolerate low oxygen stress (Staples and Buck, 2009; Storey and Storey, 2012; Biggar and Storey, 2015; Storey, 2015). In the last 25 years, researchers have been studying the role of redox metabolism in the survival machinery of animals under low oxygen stress and estivation. It was observed that many animal species from eight phyla (including vertebrates and invertebrates) upregulate endogenous antioxidant levels during low oxygen stress (Moreira et al., 2016). Phenotypically, studies from many laboratories have shown increases in catalase, superoxide dismutases, and glutathione peroxidases activities, and also in the levels of reduced glutathione (GSH), under stress conditions. The biological phenomenon of antioxidant upregulation in response to low oxygen availability is referred to as ""preparation for oxidative stress"" (POS; Hermes-Lima et al., 1998, 2001; Hermes-Lima and Zenteno-Savín, 2002). © 2018 Moreira, Oliveira, Liz-Guimarães, Diniz-Rojas, Campos and Hermes-Lima.","Antioxidant; Biochemical adaptation; Estivation; Hypoxia; Oxidative stress; Reactive oxygen species","erratum","Erratum","Final","All Open Access; Gold Open Access; Green Open Access","Scopus","2-s2.0-85049863923"
"Dematei A.; Nunes J.B.; Moreira D.C.; Jesus J.A.; Laurenti M.D.; Mengarda A.C.A.; Vieira M.S.; Do Amaral C.P.; Domingues M.M.; De Moraes J.; Passero L.F.D.; Brand G.; Bessa L.J.; Wimmer R.; Kuckelhaus S.A.S.; Tomás A.M.; Santos N.C.; Plácido A.; Eaton P.; Leite J.R.S.A.","Dematei, Anderson (57195954021); Nunes, João B. (57224897640); Moreira, Daniel C. (55308326300); Jesus, Jéssica A. (56545362300); Laurenti, Márcia D. (6603608113); Mengarda, Ana C. A. (57195245649); Vieira, Maria Silva (57212117412); Do Amaral, Constança Pais (57211666174); Domingues, Marco M. (24314908700); De Moraes, Josué (35763592900); Passero, Luiz F. D. (10840752600); Brand, Guilherme (8639196800); Bessa, Lucinda J. (37092470400); Wimmer, Reinhard (7005403263); Kuckelhaus, Selma A. S. (8313515500); Tomás, Ana M. (7006293534); Santos, Nuno C. (55940818300); Plácido, Alexandra (55232677900); Eaton, Peter (7005831154); Leite, José Roberto S. A. (7201818325)","57195954021; 57224897640; 55308326300; 56545362300; 6603608113; 57195245649; 57212117412; 57211666174; 24314908700; 35763592900; 10840752600; 8639196800; 37092470400; 7005403263; 8313515500; 7006293534; 55940818300; 55232677900; 7005831154; 7201818325","Mechanistic Insights into the Leishmanicidal and Bactericidal Activities of Batroxicidin, a Cathelicidin-Related Peptide from a South American Viper (Bothrops atrox)","2021","Journal of Natural Products","84","6","","1787","1798","11","15","10.1021/acs.jnatprod.1c00153","https://www.scopus.com/inward/record.uri?eid=2-s2.0-85108565418&doi=10.1021%2facs.jnatprod.1c00153&partnerID=40&md5=6ad2a3755748b9c2292b0b19334e6889","Snake venoms are important sources of bioactive molecules, including those with antiparasitic activity. Cathelicidins form a class of such molecules, which are produced by a variety of organisms. Batroxicidin (BatxC) is a cathelicidin found in the venom of the common lancehead (Bothrops atrox). In the present work, BatxC and two synthetic analogues, BatxC(C-2.15Phe) and BatxC(C-2.14Phe)des-Phe1, were assessed for their microbicidal activity. All three peptides showed a broad-spectrum activity on Gram-positive and-negative bacteria, as well as promastigote and amastigote forms of Leishmania (Leishmania) amazonensis. Circular dichroism (CD) and nuclear magnetic resonance (NMR) data indicated that the three peptides changed their structure upon interaction with membranes. Biomimetic membrane model studies demonstrated that the peptides exert a permeabilization effect in prokaryotic membranes, leading to cell morphology distortion, which was confirmed by atomic force microscopy (AFM). The molecules considered in this work exhibited bactericidal and leishmanicidal activity at low concentrations, with the AFM data suggesting membrane pore formation as their mechanism of action. These peptides stand as valuable prototype drugs to be further investigated and eventually used to treat bacterial and protozoal infections.  © ","","Amino Acid Sequence; Animals; Anti-Bacterial Agents; Antimicrobial Peptides; Antiprotozoal Agents; Bothrops; Cathelicidins; Cells, Cultured; Leishmania; Macrophages; Mice, Inbred BALB C; Microbial Sensitivity Tests; Snake Venoms; South America; amphotericin B; antileishmanial agent; bactericide; batroxicidin; cathelicidin; snake venom; unclassified drug; antiinfective agent; antiprotozoal agent; cathelicidin; polypeptide antibiotic agent; amastigote; animal cell; antibacterial activity; atomic force microscopy; bactericidal activity; Bothrops; Bothrops atrox; cell membrane permeability; circular dichroism; concentration response; controlled study; cytotoxicity assay; drug mechanism; drug potency; drug screening; drug selectivity; Enterococcus faecalis; Escherichia coli; human; human cell; Leishmania amazonensis; leishmanicidal activity; membrane model; methicillin resistant Staphylococcus aureus; nonhuman; nuclear magnetic resonance; promastigote; Pseudomonas aeruginosa; Review; spectrofluorometry; Staphylococcus aureus; amino acid sequence; animal; Bagg albino mouse; cell culture; chemistry; drug effect; Leishmania; macrophage; microbial sensitivity test; South America","Review","Final","","Scopus","2-s2.0-85108565418"
"Oliveira M.F.; Geihs M.A.; França T.F.A.; Moreira D.C.; Hermes-Lima M.","Oliveira, Marcus F. (7402586578); Geihs, Marcio A. (23097568800); França, Thiago F.A. (57195402845); Moreira, Daniel C. (55308326300); Hermes-Lima, Marcelo (7003603863)","7402586578; 23097568800; 57195402845; 55308326300; 7003603863","Is ""preparation for oxidative stress"" a case of physiological conditioning hormesis?","2018","Frontiers in Physiology","9","AUG","945","","","","66","10.3389/fphys.2018.00945","https://www.scopus.com/inward/record.uri?eid=2-s2.0-85054932289&doi=10.3389%2ffphys.2018.00945&partnerID=40&md5=8722a982f84a23691b43221330a7bba6","[No abstract available]","Antioxidant; Biochemical adaptation; Estivation; Hypoxia; Oxidative stress; Reactive oxygen species; Redox","phosphatidylinositol 3,4,5 trisphosphate 3 phosphatase; protein tyrosine phosphatase 1B; transcription factor Nrf2; adaptation; antioxidant activity; cell hypoxia; enzyme activity; hormesis; nonhuman; Note; oxidation reduction state; oxidative stress; physiologic conditioning; protein expression; protein phosphorylation","Note","Final","All Open Access; Gold Open Access; Green Open Access","Scopus","2-s2.0-85054932289"
