"Authors","Author full names","Author(s) ID","Title","Year","Source title","Volume","Issue","Art. No.","Page start","Page end","Page count","Cited by","DOI","Link","Abstract","Author Keywords","Index Keywords","Document Type","Publication Stage","Open Access","Source","EID"
"Dalvi L.T.; Moreira D.C.; Alonso A.; de Avellar I.G.J.; Hermes-Lima M.","Dalvi, Luana T. (8314931800); Moreira, Daniel C. (55308326300); Alonso, Antonio (7402478359); de Avellar, Isa G.J. (6507318574); Hermes-Lima, Marcelo (7003603863)","8314931800; 55308326300; 7402478359; 6507318574; 7003603863","Antioxidant activity and mechanism of commercial Rama Forte persimmon fruits (Diospyros kaki)","2018","PeerJ","2018","7","e5223","","","","7","10.7717/peerj.5223","https://www.scopus.com/inward/record.uri?eid=2-s2.0-85050637755&doi=10.7717%2fpeerj.5223&partnerID=40&md5=8f90300ec12b8de087703adb2bb4ca5e","This study aimed to characterize the antioxidant properties of Rama Forte persimmon, a tannin-rich fruit variety produced in Brazil. Extracts prepared with lyophilized pulps from fruits obtained in local markets were analyzed individually to evaluate the extent of antioxidant protection and investigate the antioxidant mechanism. Iron-mediated hydroxylation of 5,5-dimethyl-1-pirrolidine-N-oxide, determined by electron paramagnetic resonance (EPR), and oxidative degradation of 2-deoxyribose (2-DR) were inhibited by fruit extracts in a dose-dependent manner. There was a considerable individual variability in inhibition of 2-DR degradation by individual fruits. Higher protection of 2-DR degradation (by the extracts) was observed in Fe(III)-citrate/ascorbate in comparison with Fe(III)-EDTA/ascorbate system; however, antioxidant effectiveness of fruit extracts was not diminished by increasing EDTA concentration by 10-fold. Other competition experiments using the 2-DR assay (varying pre-incubation time and 2-DR concentration) indicated that protection comes mainly from free radical scavenging, rather that metal chelation antioxidant activity. Persimmon extracts prevented iron-mediated lipid peroxidation in rat liver homogenates, which correlated significantly with the inhibition of 2-DR oxidation. Finally, sugar content of individual fruits correlated inversely with inhibition of 2-DR degradation, which could indicate that maturation decreases soluble antioxidant concentration or efficiency. In conclusion, lipid peroxidation, 2-DR and EPR experiments indicated that extracts from commercial fruits showed mainly radical-scavenger activity and relevant antioxidant activity. © 2018 Dalvi et al.","Fruit maturation; Lipid peroxidation; Oxidative stress; Polyphenol; Tannin","2 deoxyribose; ascorbic acid; chelating agent; citrate sodium; Diospyros kaki extract; edetic acid; ellagic acid; ferric chloride; hydrogen; malonaldehyde; phosphoric acid; plant extract; tannin; thiobarbituric acid reactive substance; unclassified drug; analysis of variance; antioxidant activity; Article; astringency; Brazil; centrifugation; cervical spine dislocation; chemical phenomena; chronic disease; clinical evaluation; comparative study; controlled study; correlation analysis; degradation; electron spin resonance; enzyme structure, function and variability; free radical scavenging assay; frequency analysis; genetic variability; IC50; in vitro propagation; incubation temperature; light dark cycle; lipid peroxidation assay; maturation; nonhuman; nutrition; oxidation; persimmon; phonetics; skin maceration; spectroscopy; temperature","Article","Final","All Open Access; Gold Open Access; Green Open Access","Scopus","2-s2.0-85050637755"
"Aguilar S.; Brunetti A.E.; Garay A.V.; Santos L.C.; Perez L.O.; Moreira D.; Cancelarich N.L.; Barbosa E.A.; Basso N.G.; de Freitas S.M.; Faivovich J.; Brand G.; Cabrera G.M.; Leite J.R.S.A.; Marani M.M.","Aguilar, Silvana (55535216400); Brunetti, Andrés E. (55314083400); Garay, Aisel Valle (57202954633); Santos, Liem Canet (57810778800); Perez, Luis O. (57203047122); Moreira, Daniel (55308326300); Cancelarich, Natalia L. (57204597794); Barbosa, Eder Alves (14044592700); Basso, Néstor G. (7005272210); de Freitas, Sonia Maria (7004278989); Faivovich, Julián (6603284210); Brand, Guilherme (8639196800); Cabrera, Gabriela M. (7006930507); Leite, José R.S.A. (7201818325); Marani, Mariela M. (56734259800)","55535216400; 55314083400; 57202954633; 57810778800; 57203047122; 55308326300; 57204597794; 14044592700; 7005272210; 7004278989; 6603284210; 8639196800; 7006930507; 7201818325; 56734259800","Structure and function of cationic hylin bioactive peptides from the tree frog Boana pulchella in interaction with lipid membranes","2023","Peptides","159","","170900","","","","10","10.1016/j.peptides.2022.170900","https://www.scopus.com/inward/record.uri?eid=2-s2.0-85141953852&doi=10.1016%2fj.peptides.2022.170900&partnerID=40&md5=a0f5adf095a523393398fa625b9ea54f","Amphibians have a great diversity of bioactive peptides in their skin. The cDNA prepro-peptide sequencing allowed the identification of five novel mature peptides expressed in the skin of Boana pulchella, four with similar sequences to hylin peptides having a cationic amphipathic-helical structure. Whole mature peptides and some of their fragments were chemically-synthesized and tested against Gram-positive and Gram-negative bacterial strains. The mature peptide hylin-Pul3 was the most active, with a MIC= 14 µM against Staphylococcus aureus. Circular dichroism assays indicated that peptides are mostly unstructured in buffer solutions. Still, adding large unilamellar vesicles composed of dimyristoyl phosphatidylcholine and dimyristoylphosphatidylglycerol increased the α-helix content of novel hylins. These results demonstrate the strong influence of the environment on peptide conformation and highlight its significance while addressing the pharmacology of peptides and their biological function in frogs. © 2022 Elsevier Inc.","Amphibians; Antimicrobial peptides; Boana; CDNA; Circular dichroism; Hylin; Large Unilamellar Vesicles","Amino Acid Sequence; Animals; Anura; Circular Dichroism; Lipids; Peptides; dimyristoylphosphatidylcholine; dimyristoylphosphatidylglycerol; hylin peptide; hylin pul1; hylin pul2; hylin pul3; hylin pul4; peptide; prasin b pul; unclassified drug; hylin; lipid; peptide; adult; alpha helix; amino acid sequence; animal experiment; antimicrobial activity; Anura; Article; bacterial strain; biological activity; Boana pulchella; circular dichroism; controlled study; Escherichia coli; Gram negative bacterium; Gram positive bacterium; hemolysis; lipid membrane; male; minimum inhibitory concentration; nonhuman; photon correlation spectroscopy; physical chemistry; protein analysis; protein conformation; protein expression; protein function; protein interaction; protein secondary structure; protein structure; protein synthesis; sequence analysis; skin secretion; Staphylococcus aureus; animal; chemistry","Article","Final","","Scopus","2-s2.0-85141953852"
"Moreira D.C.; Welker A.F.; Campos É.G.; De Souza S.C.R.; Hermes-Lima M.","Moreira, Daniel C. (55308326300); Welker, Alexis F. (8585126900); Campos, Élida G. (56234121700); De Souza, Silvia Cristina R. (7102117070); Hermes-Lima, Marcelo (7003603863)","55308326300; 8585126900; 56234121700; 7102117070; 7003603863","Subtropical hibernation in juvenile tegu lizards (Salvator merianae): Insights from intestine redox dynamics","2018","Scientific Reports","8","1","9368","","","","9","10.1038/s41598-018-27263-x","https://www.scopus.com/inward/record.uri?eid=2-s2.0-85048951203&doi=10.1038%2fs41598-018-27263-x&partnerID=40&md5=1a81849cd2a82978094bc9c429c2f056","Juvenile tegu lizards (Salvator merianae) experience gradual and mild temperature changes from autumn to winter in their habitat. This tropical/subtropical reptile enter a state of dormancy, with an 80% reduction in metabolic rate, that remains almost constant during winter. The redox metabolism in non-mammalian vertebrates that hibernate under such distinguished conditions is poorly understood. We analyzed the redox metabolism in the intestine of juvenile tegus during different stages of their first annual cycle. The effect of food deprivation (in spring) was also studied to compare with fasting during hibernation. Both winter dormancy and food deprivation caused decreases in reduced glutathione levels and glutathione transferase activity. While glutathione peroxidase and glutathione transferase activities decreased during winter dormancy, as well as glutathione (GSH) levels, other antioxidant enzymes (catalase, superoxide dismutase and glutathione reductase) remained unchanged. Notably, levels of disulfide glutathione (GSSG) were 2.1-fold higher in late autumn, when animals were in the process of depressing metabolism towards hibernation. This increased ""oxidative tonus"" could be due to a disruption in NADPH-dependent antioxidant systems. In dormancy, GSSG and lipid hydroperoxides were diminished by 60-70%. The results suggest that the entrance into hibernation is the main challenge for the redox homeostasis in the intestine of juvenile tegus. © 2018 The Author(s).","","Animals; Antioxidants; Catalase; Energy Metabolism; Glutathione; Glutathione Disulfide; Glutathione Peroxidase; Glutathione Reductase; Intestinal Mucosa; Lizards; Oxidation-Reduction; antioxidant; catalase; glutathione; glutathione disulfide; glutathione peroxidase; glutathione reductase; animal; energy metabolism; intestine mucosa; lizard; metabolism; oxidation reduction reaction; physiology","Article","Final","All Open Access; Gold Open Access; Green Open Access","Scopus","2-s2.0-85048951203"
"Vasconcelos A.G.; Barros A.L.A.N.; Cabral W.F.; Moreira D.C.; da Silva I.G.M.; Silva-Carvalho A.É.; de Almeida M.P.; Albuquerque L.F.F.; dos Santos R.C.; S. Brito A.K.; Saldanha-Araújo F.; Arcanjo D.D.R.; C. Martins M.C.; dos S. Borges T.K.; Báo S.N.; Plácido A.; Eaton P.; Kuckelhaus S.A.S.; Leite J.R.S.A.","Vasconcelos, Andreanne G. (57055189300); Barros, Ana Luisa A. N. (57327792500); Cabral, Wanessa F. (57126003500); Moreira, Daniel C. (55308326300); da Silva, Ingrid Gracielle M. (57211487516); Silva-Carvalho, Amandda É. (57204085906); de Almeida, Miguel P. (55189516000); Albuquerque, Lucas F. F. (57202609898); dos Santos, Raimunda C. (56723523300); S. Brito, Ana Karolinne (57327649100); Saldanha-Araújo, Felipe (25026388400); Arcanjo, Daniel D. R. (47861880200); C. Martins, Maria do Carmo (57327792600); dos S. Borges, Tatiana K. (57327933000); Báo, Sônia N. (7201558797); Plácido, Alexandra (55232677900); Eaton, Peter (7005831154); Kuckelhaus, Selma A. S. (8313515500); Leite, José Roberto S. A. (7201818325)","57055189300; 57327792500; 57126003500; 55308326300; 57211487516; 57204085906; 55189516000; 57202609898; 56723523300; 57327649100; 25026388400; 47861880200; 57327792600; 57327933000; 7201558797; 55232677900; 7005831154; 8313515500; 7201818325","Promising self-emulsifying drug delivery system loaded with lycopene from red guava (Psidium guajava L.): in vivo toxicity, biodistribution and cytotoxicity on DU-145 prostate cancer cells","2021","Cancer Nanotechnology","12","1","30","","","","12","10.1186/s12645-021-00103-w","https://www.scopus.com/inward/record.uri?eid=2-s2.0-85118747403&doi=10.1186%2fs12645-021-00103-w&partnerID=40&md5=d343a1c5f8020ef6ce1cfcb543ccc609","Background: Self-emulsifying drug delivery systems (SEDDSs) have attracted attention because of their effects on solubility and bioavailability of lipophilic compounds. Herein, a SEDDS loaded with lycopene purified from red guava (nanoLPG) was produced. The nanoemulsion was characterized using dynamic light scattering (DLS), zeta potential measurement, nanoparticle tracking analysis (NTA), transmission electron microscopy (TEM), Fourier-transform infrared spectroscopy (FTIR), lycopene content quantification, radical scavenging activity and colloidal stability in cell culture medium. Then, in vivo toxicity and tissue distribution in orally treated mice and cytotoxicity on human prostate carcinoma cells (DU-145) and human peripheral blood mononuclear cells (PBMC) were evaluated. Results: NanoLPG exhibited physicochemical properties with a size around 200 nm, negative zeta-potential, and spherical morphology. The size, polydispersity index, and zeta potential parameters suffered insignificant alterations during the 12 month storage at 5 °C, which were associated with lycopene stability at 5 °C for 10 months. The nanoemulsion showed partial aggregation in cell culture medium at 37 °C after 24 h. NanoLPG at 0.10 mg/mL exhibited radical scavenging activity equivalent to 0.043 ± 0.002 mg Trolox/mL. The in vivo studies did not reveal any significant changes in clinical, behavioral, hematological, biochemical, and histopathological parameters in mice orally treated with nanoLPG at 10 mg/kg for 28 days. In addition, nanoLPG successfully delivered lycopene to the liver, kidney and prostate in mice, improved its cytotoxicity against DU-145 prostate cancer cells—probably by pathway independent on classical necrosis and apoptosis—and did not affect PBMC viability. Conclusions: Thus, nanoLPG stands as a promising and biosafe lycopene delivery system for further development of nanotechnology-based health products. Graphical Abstract: [Figure not available: see fulltext.] © 2021, The Author(s).","Antitumoral; Carotenoids; Guava fruit; Nanomedicine; Self-emulsifying","1,1 diphenyl 2 picrylhydrazyl; acetone; acetonitrile; alanine aminotransferase; alcohol; alkaline phosphatase; ammonium acetate; aspartate aminotransferase; buffer; chloroform; cholesterol; coconut oil; creatinine; dichloromethane; dimethyl sulfoxide; ficoll; formaldehyde; glucose; guava extract; hexane; lycopene; lycopene from red guava; methanol; phosphate buffered saline; polysorbate 80; propidium iodide; resin; triacylglycerol; trolox C; trypan blue; unclassified drug; uranyl acetate; urea; animal experiment; animal model; animal tissue; antioxidant activity; Article; biodistribution; controlled study; cytotoxicity; dispersity; drug bioavailability; drug delivery system; drug distribution; DU145 cell line; fetal bovine serum; flow cytometry; fluorescence microscopy; Fourier transform infrared spectroscopy; free radical scavenging assay; high performance liquid chromatography; histopathology; human; human cell; male; mouse; MTT assay; nanoemulsion; necrosis; nonhuman; peripheral blood mononuclear cell; photon correlation spectroscopy; physical chemistry; self emulsifying drug delivery system; Swiss Webster mouse; toxicity assay; transmission electron microscopy; ultraviolet visible spectrophotometry; zeta potential","Article","Final","All Open Access; Gold Open Access","Scopus","2-s2.0-85118747403"
"Silva-Carvalho A.É.; Oliveira N.N.D.; Machado J.V.L.; Moreira D.C.; Brand G.D.; Leite J.R.S.A.; Plácido A.; Eaton P.; Saldanha-Araujo F.","Silva-Carvalho, Amandda Évelin (57204085906); Oliveira, Nakaly Natiely de (58515332500); Machado, Julia Viana Lafetá (58514204600); Moreira, Daniel Carneiro (55308326300); Brand, Guilherme Dotto (8639196800); Leite, José Roberto S. A. (7201818325); Plácido, Alexandra (55232677900); Eaton, Peter (7005831154); Saldanha-Araujo, Felipe (25026388400)","57204085906; 58515332500; 58514204600; 55308326300; 8639196800; 7201818325; 55232677900; 7005831154; 25026388400","The Peptide Salamandrin-I Modulates Components Involved in Pyroptosis and Induces Cell Death in Human Leukemia Cell Line HL-60","2023","Pharmaceutics","15","7","1864","","","","1","10.3390/pharmaceutics15071864","https://www.scopus.com/inward/record.uri?eid=2-s2.0-85166343272&doi=10.3390%2fpharmaceutics15071864&partnerID=40&md5=b823a85e8e0accae3e420b1dcbcad34c","Amphibian secretions have been extensively investigated for the production of bioactive molecules. Salamandrin-I is an antioxidant peptide, isolated from the skin secretion of the fire salamander, that has induced no toxicity in microglia or erythrocytes. Importantly, the administration of antioxidants may constitute an adequate therapeutic approach to cancer treatment. Here, with the purpose of better characterizing the therapeutic potential of salamandrin-I, we investigated whether this antioxidant peptide also exerts anticancer activity, using the human leukemia cell line HL-60 as a cancer model. Salamandrin-I treatment induced a significant reduction in HL-60 proliferation, which was accompanied by cell cycle arrest. Furthermore, the peptide-induced cell death showed a significant increase in the LDH release in HL-60 cells. The cellular toxicity exerted by salamandrin-I is possibly related to pyroptosis, since the HL-60 cells showed loss of mitochondrial membrane potential and hyperexpression of inflammasome components following the peptide treatment. This is the first demonstration of the anticancer potential of the salamandrin-I peptide. Such results are important, as they offer relevant insights into the field of cancer therapy and allow the design of future bioactive molecules using salamandrin-I as a template. © 2023 by the authors.","antioxidant peptide; HL-60; leukemia; pyroptosis; salamandrin-I","antimitotic agent; cryopyrin; inflammasome; interleukin 1beta; interleukin 1beta converting enzyme; lactate dehydrogenase; salamandrin I; unclassified drug; antiproliferative activity; Article; cell proliferation; cell viability; controlled study; cytotoxicity; drug determination; drug effect; enzyme activation; enzyme release; G2 phase cell cycle checkpoint; gene expression profiling; HL-60 cell line; human; human cell; mitochondrial membrane potential; protein expression; pyroptosis","Article","Final","All Open Access; Gold Open Access","Scopus","2-s2.0-85166343272"
"Dematei A.; Costa S.R.; Moreira D.C.; Barbosa E.A.; Friaça Albuquerque L.F.; Vasconcelos A.G.; Nascimento T.; Silva P.C.; Silva-Carvalho A.É.; Saldanha-Araújo F.; Silva Mancini M.C.; Saboia Ponte L.G.; Neves Bezerra R.M.; Simabuco F.M.; Batagin-Neto A.; Brand G.; Borges T.K.S.; Eaton P.; Leite J.R.S.A.","Dematei, Anderson (57195954021); Costa, Samuel Ribeiro (58010475400); Moreira, Daniel C. (55308326300); Barbosa, Eder Alves (14044592700); Friaça Albuquerque, Lucas F. (58010571200); Vasconcelos, Andreanne G. (57055189300); Nascimento, Tiago (58010005000); Silva, Pedro Costa (58010571300); Silva-Carvalho, Amandda É. (57204085906); Saldanha-Araújo, Felipe (25026388400); Silva Mancini, Mariana Camargo (57412741200); Saboia Ponte, Luis Gustavo (58010096300); Neves Bezerra, Rosangela Maria (7003699883); Simabuco, Fernando Moreira (15926246800); Batagin-Neto, Augusto (15069371100); Brand, Guilherme (8639196800); Borges, Tatiana Karla S. (56465595400); Eaton, Peter (7005831154); Leite, José Roberto S. A. (7201818325)","57195954021; 58010475400; 55308326300; 14044592700; 58010571200; 57055189300; 58010005000; 58010571300; 57204085906; 25026388400; 57412741200; 58010096300; 7003699883; 15926246800; 15069371100; 8639196800; 56465595400; 7005831154; 7201818325","Antioxidant and Neuroprotective Effects of the First Tryptophyllin Found in Snake Venom (Bothrops moojeni)","2022","Journal of Natural Products","85","12","","2695","2705","10","5","10.1021/acs.jnatprod.2c00304","https://www.scopus.com/inward/record.uri?eid=2-s2.0-85143988068&doi=10.1021%2facs.jnatprod.2c00304&partnerID=40&md5=236b408ceb233ef7429e5f64daf4d33e","In this study, we report the isolation, characterization, and synthesis of the peptide BmT-2 belonging to the tryptophyllins family, isolated from the venom of the snake Bothrops moojeni. This is the first time a tryptophyllin is identified in snake venom. We tested whether BmT-2 had cytotoxic effects and antioxidant activity in a set of experiments that included both in vitro and cell-based assays. BmT-2 presented a radical scavenging activity toward ABTS• and AAPH-derived radicals. BmT-2 protected fluorescein, DNA molecules, and human red blood cells (RBCs) from free radicals generated by the thermal decomposition of AAPH. The novel tryptophyllin was not toxic in cell viability tests, where it (up to 0.4 mg/mL) did not cause hemolysis of human RBCs and did not cause significant loss of cell viability, showing a CC50 > 1.5 mM for cytotoxic effects against SK-N-BE(2) neuroblastoma cells. BmT-2 prevented the arsenite-induced upregulation of Nrf2 in Neuro-2a neuroblasts and the phorbol myristate acetate-induced overgeneration of reactive oxygen species and reactive nitrogen species in SK-N-BE(2) neuroblastoma cells. Electronic structure calculations and full atomistic reactive molecular dynamics simulations revealed the relevant contribution of aromatic residues in BmT-2 to its antioxidant properties. Our study presents a novel peptide classified into the family of the tryptophyllins, which has been reported exclusively in amphibians. Despite the promising results on its antioxidant activity and low cytotoxicity, the mechanisms of action of BmT-2 still need to be further elucidated.  © 2022 American Chemical Society.","","Animals; Antioxidants; Bothrops; Crotalid Venoms; Humans; Neuroblastoma; Neuroprotective Agents; Peptides; Snake Venoms; alpha tocopherol; antioxidant; aromatic compound; arsenic trioxide; ascorbic acid; bmt 2; carnosine; DNA; fluorescein; free radical; glutathione; glycylhistidyllysine; melatonin; neuroprotective agent; peptide; phorbol 13 acetate 12 myristate; reactive nitrogen species; reactive oxygen metabolite; salamandrin I; snake venom; transcription factor Nrf2; trolox C; tryptophyllin; unclassified drug; 2,2'-azobis(2-amidinopropane); antioxidant; neuroprotective agent; peptide; snake venom; ABTS radical scavenging assay; antioxidant activity; Article; Bothrops; Bothrops moojeni; cell viability; computer model; controlled study; drug cytotoxicity; drug isolation; drug structure; drug synthesis; erythrocyte; hemolysis; high performance liquid chromatography; human; human cell; in vitro study; matrix assisted laser desorption ionization time of flight mass spectrometry; molecular dynamics; Neuro-2a cell line; neuroprotection; ORAC assay; oxidative stress; peptide synthesis; SK-N-BE(2) cell line; upregulation; animal; chemistry; neuroblastoma","Article","Final","","Scopus","2-s2.0-85143988068"
