"Authors","Author full names","Author(s) ID","Title","Year","Source title","Volume","Issue","Art. No.","Page start","Page end","Page count","Cited by","DOI","Link","Author Keywords","Index Keywords","Document Type","Publication Stage","Open Access","Source","EID"
"Gisbert E.; Moreira D.C.; Mozanzadeh M.T.; Lu K.","Gisbert, E. (7003466647); Moreira, D.C. (55308326300); Mozanzadeh, M.T. (42861974200); Lu, K. (36537599900)","7003466647; 55308326300; 42861974200; 36537599900","Editorial: Rising stars in aquatic physiology: 2022","2022","Frontiers in Physiology","13","","1081961","","","","0","10.3389/fphys.2022.1081961","https://www.scopus.com/inward/record.uri?eid=2-s2.0-85142615164&doi=10.3389%2ffphys.2022.1081961&partnerID=40&md5=ba0ab6184200fcf961cc8fdfdc9f584f","elasmobranch; longevity; mollusc; physiology; stress; teleost","carbon dioxide; hydrocortisone; mineralocorticoid receptor; phosphatase; phosphatidylinositol 3,4,5 trisphosphate 3 phosphatase; reactive oxygen metabolite; RNA; aquatic environment; cell respiration; chromosome deletion; cleaning; climate change; community; coral reef; diet; ecology; ectoparasitism; Editorial; embryo development; energy; environmental exposure; environmental impact; fish; gene; genomics; gr1 gene; gr2 gene; growth; immunoregulation; infection rate; lifespan; lipid metabolism; mr gene; nonhuman; ocean acidification; oxidative stress; parasite load; parasitism; parasitosis; physiological stress; physiology; progeny; protein function; protein hydrolysis; protein synthesis; Pseudobatos horkelii; PTEN gene; scallop; seminal plasma; Sparus aurata; sperm; spermatozoon; transcriptomics; xenobiotic metabolism","Editorial","Final","All Open Access; Gold Open Access; Green Open Access","Scopus","2-s2.0-85142615164"
"Sahin C.; Magomedova L.; Ferreira T.A.M.; Liu J.; Tiefenbach J.; Alves P.S.; Queiroz F.J.G.; Oliveira A.S.D.; Bhattacharyya M.; Grouleff J.; Nogueira P.C.N.; Silveira E.R.; Moreira D.C.; Leite J.R.S.D.A.; Brand G.D.; Uehling D.; Poda G.; Krause H.; Cummins C.L.; Romeiro L.A.S.","Sahin, Cigdem (57209608559); Magomedova, Lilia (57050673400); Ferreira, Thais A. M. (57445956700); Liu, Jiabao (56031100400); Tiefenbach, Jens (6603409456); Alves, Priscilla S. (57202434468); Queiroz, Fellipe J. G. (57444868500); Oliveira, Andressa S. De (37024645200); Bhattacharyya, Mousumi (56072145300); Grouleff, Julie (26640297300); Nogueira, Patrícia C. N. (56406158600); Silveira, Edilberto R. (54586003200); Moreira, Daniel C. (55308326300); Leite, José Roberto Souza De Almeida (7201818325); Brand, Guilherme D. (8639196800); Uehling, David (7005942190); Poda, Gennady (35510405100); Krause, Henry (7202403521); Cummins, Carolyn L. (7102791416); Romeiro, Luiz A. S. (11440180600)","57209608559; 57050673400; 57445956700; 56031100400; 6603409456; 57202434468; 57444868500; 37024645200; 56072145300; 26640297300; 56406158600; 54586003200; 55308326300; 7201818325; 8639196800; 7005942190; 35510405100; 7202403521; 7102791416; 11440180600","Phenolic Lipids Derived from Cashew Nut Shell Liquid to Treat Metabolic Diseases","2022","Journal of Medicinal Chemistry","65","3","","1961","1978","17","6","10.1021/acs.jmedchem.1c01542","https://www.scopus.com/inward/record.uri?eid=2-s2.0-85124327295&doi=10.1021%2facs.jmedchem.1c01542&partnerID=40&md5=478fbbb62bc58bc1f709559d6c14e13d","","3T3-L1 Cells; Anacardic Acids; Anacardium; Animals; Drug Design; Gene Expression; HEK293 Cells; Humans; Lipid Metabolism; Male; Mice; Mice, Inbred C57BL; Molecular Docking Simulation; Nuts; PPAR alpha; PPAR delta; PPAR gamma; Protein Domains; Zebrafish; 1 methoxy 3 pentadecyl benzene; 2 (3 pentadecylphenoxy)acetic acid; 2 acetoxy 4 pentadecylbenzoic acid; 2 acetoxy 6 pentadecylbenzoic acid; 2 hydroxy 4 pentadecylbenzoic acid; 2 hydroxy 6 pentadecylbenzoic acid; 2 methoxy 4 pentadecylbenzaldehyde; 2 methoxy 4 pentadecylbenzoic acid; 2 methoxy 6 pentadecylbenzoic acid; 2 methyl 2 (3 pentadecylphenoxy)ethyl propanoate; 2 methyl 2 (3 pentadecylphenoxy)propanoic acid; 2 methyl 2 [3 (pentadec 8 en 1 yl)phenoxy]propanoic acid; 2 [3 (pentadec 8 en 1 yl)phenoxy]acetic acid; 2 [4 [2 [3 cyclohexyl 1 (4 cyclohexylbutyl)ureido]ethyl]phenylthio] 2 methylpropionic acid; 3 pentadecylphenol; 3 pentadecylphenol acetate; anacardic acid; anacardic acid derivative; cardanol derivative; CD36 antigen; ethyl 2 (3 pentadecylphenoxy)acetate; ethyl 2 methyl 2 [3 (pentadec 8 en 1 yl)phenoxy]propanoate; ethyl 2 [3 (pentadec 8 en 1 yl)phenoxy]acetate; fatty acid binding protein; fatty acid binding protein 1; ldt 10; ldt 11; ldt 12; ldt 13; ldt 15; ldt 16; ldt 208; ldt 220; ldt 27; ldt 28; ldt 30; ldt 380; ldt 381; ldt 383; ldt 384; ldt 407; ldt 408; ldt 409; ldt 486a; ldt 487a; ldt 539a; ldt 540a; lipid; messenger RNA; methyl 2 acetoxy 6 pentadecylbenzoate; methyl 2 hydroxy 4 pentadecylbenzoate; methyl 2 methoxy 4 pentadecylbenzoate; methyl 2 methoxy 6 pentadecylbenzoate; muraglitazar; natural product; partial agonist; peroxisome proliferator activated receptor agonist; peroxisome proliferator activated receptor alpha; peroxisome proliferator activated receptor delta; peroxisome proliferator activated receptor gamma; phenol derivative; pirinixic acid; pyruvate dehydrogenase; pyruvate dehydrogenase 4; rosiglitazone; stearic acid; unclassified drug; [4 [2 (3 fluoro 4 trifluoromethylphenyl) 4 methyl 5 thiazolylmethylthio] 2 methylphenoxy]acetic acid; anacardic acid; peroxisome proliferator activated receptor alpha; peroxisome proliferator activated receptor delta; peroxisome proliferator activated receptor gamma; 3T3-L1 cell line; adipocyte; animal cell; animal experiment; animal model; animal tissue; area under the curve; Article; binding affinity; binding site; biological activity; carbon nuclear magnetic resonance; cashew nut; cell differentiation; concentration response; controlled study; crystal structure; drug bioavailability; drug design; drug efficacy; drug potency; drug receptor binding; drug screening; drug structure; drug synthesis; drug targeting; EC50; elimination rate constant; embryo; fatty acid oxidation; fatty acid transport; gene expression; genetic transfection; half life time; HEK293 cell line; human; human cell; hydrogen bond; hydrophobicity; in vitro study; in vivo study; ligand binding; lipid metabolism; liquid chromatography-mass spectrometry; liver cell; liver microsome; male; maximum concentration; maximum drug effect; metabolic disorder; metabolic stability; molecular docking; molecular dynamics; molecular recognition; mouse; mRNA expression level; nonhuman; nutshell (structure); protein expression; proton nuclear magnetic resonance; regulatory mechanism; single drug dose; structure activity relation; time to maximum plasma concentration; tissue distribution; upregulation; zebra fish; Anacardium; animal; C57BL mouse; chemistry; drug effect; genetics; metabolism; nut; protein domain; synthesis","Article","Final","All Open Access; Hybrid Gold Open Access","Scopus","2-s2.0-85124327295"
"Welker A.F.; Moreira D.C.; Hermes-Lima M.","Welker, Alexis F. (8585126900); Moreira, Daniel C. (55308326300); Hermes-Lima, Marcelo (7003603863)","8585126900; 55308326300; 7003603863","Roles of catalase and glutathione peroxidase in the tolerance of a pulmonate gastropod to anoxia and reoxygenation","2016","Journal of Comparative Physiology B: Biochemical, Systemic, and Environmental Physiology","186","5","","553","568","15","14","10.1007/s00360-016-0982-4","https://www.scopus.com/inward/record.uri?eid=2-s2.0-84964050185&doi=10.1007%2fs00360-016-0982-4&partnerID=40&md5=ee59391c27a45292cd2963f7381b7cf6","Free radicals; Glutathione; Hypoxia; Ischemia; Oxidative damage","Amitrole; Animals; Arthropod Proteins; Catalase; Glutathione Peroxidase; Hypoxia; Muscles; Oxygen; Snails; amitrole; arthropod protein; catalase; glutathione peroxidase; oxygen; animal; antagonists and inhibitors; hypoxia; metabolism; muscle; snail","Article","Final","","Scopus","2-s2.0-84964050185"
"Moreira D.C.; da Costa Tavares Sabino M.A.; Minari M.; Kuzniewski F.T.B.; Angelini R.; Hermes-Lima M.","Moreira, Daniel C. (55308326300); da Costa Tavares Sabino, Marcus Aurélio (58345724400); Minari, Marina (57211394761); Kuzniewski, Felipe Torres Brasil (57215857648); Angelini, Ronaldo (56249804800); Hermes-Lima, Marcelo (7003603863)","55308326300; 58345724400; 57211394761; 57215857648; 56249804800; 7003603863","The role of solar radiation and tidal emersion on oxidative stress and glutathione synthesis in mussels exposed to air","2023","PeerJ","11","","e15345","","","","2","10.7717/PEERJ.15345","https://www.scopus.com/inward/record.uri?eid=2-s2.0-85162816657&doi=10.7717%2fPEERJ.15345&partnerID=40&md5=83e8736c73af33434111250d48e1ee54","Aerial exposure; Antioxidant; Bivalve; Brachidontes solisianus; Hypoxia; Mytilidae; Preparation for oxidative stress; Reactive oxygen species; Ultraviolet radiation","biological marker; catalase; disulfide; glucose 6 phosphate dehydrogenase; glutathione; glutathione reductase; glutathione transferase; isocitrate dehydrogenase; malate dehydrogenase; pyruvate kinase; reactive oxygen metabolite; thiobarbituric acid reactive substance; antioxidant activity; Article; bivalve; catalysis; environmental factor; enzyme activity; glutathione metabolism; habitat; homogenate; hypoxia; immersion; mussel; Mytilidae; nonhuman; oxidation reduction reaction; oxidative stress; physiological stress; solar radiation; tidal volume; ultraviolet radiation","Article","Final","All Open Access; Gold Open Access; Green Open Access","Scopus","2-s2.0-85162816657"
"Moreira D.C.; Sabino M.A.C.T.; Kuzniewski F.T.B.; Furtado-Filho O.V.; Carvajalino-Fernández J.M.; Angelini R.; Freire C.A.; Hermes-Lima M.","Moreira, Daniel C. (55308326300); Sabino, Marcus A.C.T. (57119399700); Kuzniewski, Felipe T.B. (57215857648); Furtado-Filho, Orlando V. (17134733500); Carvajalino-Fernández, Juan M. (55909349600); Angelini, Ronaldo (56249804800); Freire, Carolina A. (7005487396); Hermes-Lima, Marcelo (7003603863)","55308326300; 57119399700; 57215857648; 17134733500; 55909349600; 56249804800; 7005487396; 7003603863","Redox metabolism in mussels (Brachidontes solisianus) under the influence of tides in a rocky beach in Southern Brazil","2021","Estuarine, Coastal and Shelf Science","258","","107424","","","","5","10.1016/j.ecss.2021.107424","https://www.scopus.com/inward/record.uri?eid=2-s2.0-85106863658&doi=10.1016%2fj.ecss.2021.107424&partnerID=40&md5=8b242cc0c5094923a30d6aa4012195f9","Aerial exposure; Antioxidant; Bivalve; Hypoxia; Reactive oxygen species; Ultraviolet radiation","Brazil; Bivalvia; Brachidontes; Invertebrata; air temperature; anoxic conditions; antioxidant; beach; bivalve; enzyme activity; glucose; intertidal environment; lipid; metabolism; oxidative stress; phosphate; protein; redox conditions; rocky shore; solar radiation; tidal cycle; tide","Article","Final","","Scopus","2-s2.0-85106863658"
"Plácido A.; Bueno J.; Barbosa E.A.; Moreira D.C.; Dias J.D.N.; Cabral W.F.; Albuquerque P.; Bessa L.J.; Freitas J.; Kuckelhaus S.A.S.; Lima F.C.D.A.; Batagin-Neto A.; Brand G.D.; Relvas J.B.; Leite J.R.S.A.; Eaton P.","Plácido, Alexandra (55232677900); Bueno, João (57216173911); Barbosa, Eder A. (14044592700); Moreira, Daniel C. (55308326300); Dias, Jhones Do Nascimento (57208758979); Cabral, Wanessa Felix (57126003500); Albuquerque, Patrícia (14526846200); Bessa, Lucinda J. (37092470400); Freitas, Jaime (57204348265); Kuckelhaus, Selma A. S. (8313515500); Lima, Filipe C. D. A. (56052811600); Batagin-Neto, Augusto (15069371100); Brand, Guilherme D. (8639196800); Relvas, João B. (6602197103); Leite, José Roberto S. A. (7201818325); Eaton, Peter (7005831154)","55232677900; 57216173911; 14044592700; 55308326300; 57208758979; 57126003500; 14526846200; 37092470400; 57204348265; 8313515500; 56052811600; 15069371100; 8639196800; 6602197103; 7201818325; 7005831154","The antioxidant peptide salamandrin-i: First bioactive peptide identified from skin secretion of salamandra genus (salamandra salamandra)","2020","Biomolecules","10","4","512","","","","17","10.3390/biom10040512","https://www.scopus.com/inward/record.uri?eid=2-s2.0-85082731024&doi=10.3390%2fbiom10040512&partnerID=40&md5=d918570c1d22113282a6899ac555ca74","Antioxidant peptides; Bioactive molecules; Portuguese biodiversity; Salamandra salamandra","Amphibian Proteins; Animals; Anti-Bacterial Agents; Antioxidants; Circular Dichroism; Drug Evaluation, Preclinical; Humans; Microbial Sensitivity Tests; Moths; Peptides; Salamandra; Skin; Toxicity Tests; antioxidant; cefepime; glutathione; peptide; salamandrin I; trolox C; unclassified drug; amphibian protein; antiinfective agent; antioxidant; peptide; ABTS radical scavenging assay; amino acid sequence; animal experiment; animal tissue; antibacterial activity; antioxidant activity; Article; circular dichroism; computer model; controlled study; cytotoxicity; density functional theory; disk diffusion; DPPH radical scavenging assay; Enterococcus faecalis; Escherichia coli; Galleria mellonella; hemolysis; histology; human; human cell; LD50; matrix assisted laser desorption ionization time of flight mass spectrometry; microglial cell line; minimum inhibitory concentration; nonhuman; peptide analysis; peptide synthesis; protein purification; protein secondary structure; Pseudomonas aeruginosa; reversed phase high performance liquid chromatography; Salamandra salamandra; sequence analysis; skin secretion; Staphylococcus aureus; structure analysis; animal; chemistry; drug effect; isolation and purification; microbial sensitivity test; moth; preclinical study; Salamandra; skin; toxicity testing","Article","Final","All Open Access; Gold Open Access; Green Open Access","Scopus","2-s2.0-85082731024"
"Dalvi L.T.; Moreira D.C.; Alonso A.; de Avellar I.G.J.; Hermes-Lima M.","Dalvi, Luana T. (8314931800); Moreira, Daniel C. (55308326300); Alonso, Antonio (7402478359); de Avellar, Isa G.J. (6507318574); Hermes-Lima, Marcelo (7003603863)","8314931800; 55308326300; 7402478359; 6507318574; 7003603863","Antioxidant activity and mechanism of commercial Rama Forte persimmon fruits (Diospyros kaki)","2018","PeerJ","2018","7","e5223","","","","6","10.7717/peerj.5223","https://www.scopus.com/inward/record.uri?eid=2-s2.0-85050637755&doi=10.7717%2fpeerj.5223&partnerID=40&md5=8f90300ec12b8de087703adb2bb4ca5e","Fruit maturation; Lipid peroxidation; Oxidative stress; Polyphenol; Tannin","2 deoxyribose; ascorbic acid; chelating agent; citrate sodium; Diospyros kaki extract; edetic acid; ellagic acid; ferric chloride; hydrogen; malonaldehyde; phosphoric acid; plant extract; tannin; thiobarbituric acid reactive substance; unclassified drug; analysis of variance; antioxidant activity; Article; astringency; Brazil; centrifugation; cervical spine dislocation; chemical phenomena; chronic disease; clinical evaluation; comparative study; controlled study; correlation analysis; degradation; electron spin resonance; enzyme structure, function and variability; free radical scavenging assay; frequency analysis; genetic variability; IC50; in vitro propagation; incubation temperature; light dark cycle; lipid peroxidation assay; maturation; nonhuman; nutrition; oxidation; persimmon; phonetics; skin maceration; spectroscopy; temperature","Article","Final","All Open Access; Gold Open Access; Green Open Access","Scopus","2-s2.0-85050637755"
"Aguilar S.; Brunetti A.E.; Garay A.V.; Santos L.C.; Perez L.O.; Moreira D.; Cancelarich N.L.; Barbosa E.A.; Basso N.G.; de Freitas S.M.; Faivovich J.; Brand G.; Cabrera G.M.; Leite J.R.S.A.; Marani M.M.","Aguilar, Silvana (55535216400); Brunetti, Andrés E. (55314083400); Garay, Aisel Valle (57202954633); Santos, Liem Canet (57810778800); Perez, Luis O. (57203047122); Moreira, Daniel (55308326300); Cancelarich, Natalia L. (57204597794); Barbosa, Eder Alves (14044592700); Basso, Néstor G. (7005272210); de Freitas, Sonia Maria (7004278989); Faivovich, Julián (6603284210); Brand, Guilherme (8639196800); Cabrera, Gabriela M. (7006930507); Leite, José R.S.A. (57811416300); Marani, Mariela M. (56734259800)","55535216400; 55314083400; 57202954633; 57810778800; 57203047122; 55308326300; 57204597794; 14044592700; 7005272210; 7004278989; 6603284210; 8639196800; 7006930507; 57811416300; 56734259800","Structure and function of cationic hylin bioactive peptides from the tree frog Boana pulchella in interaction with lipid membranes","2023","Peptides","159","","170900","","","","5","10.1016/j.peptides.2022.170900","https://www.scopus.com/inward/record.uri?eid=2-s2.0-85141953852&doi=10.1016%2fj.peptides.2022.170900&partnerID=40&md5=a0f5adf095a523393398fa625b9ea54f","Amphibians; Antimicrobial peptides; Boana; CDNA; Circular dichroism; Hylin; Large Unilamellar Vesicles","Amino Acid Sequence; Animals; Anura; Circular Dichroism; Lipids; Peptides; dimyristoylphosphatidylcholine; dimyristoylphosphatidylglycerol; hylin peptide; hylin pul1; hylin pul2; hylin pul3; hylin pul4; peptide; prasin b pul; unclassified drug; hylin; lipid; peptide; adult; alpha helix; amino acid sequence; animal experiment; antimicrobial activity; Anura; Article; bacterial strain; biological activity; Boana pulchella; circular dichroism; controlled study; Escherichia coli; Gram negative bacterium; Gram positive bacterium; hemolysis; lipid membrane; male; minimum inhibitory concentration; nonhuman; photon correlation spectroscopy; physical chemistry; protein analysis; protein conformation; protein expression; protein function; protein interaction; protein secondary structure; protein structure; protein synthesis; sequence analysis; skin secretion; Staphylococcus aureus; animal; chemistry","Article","Final","","Scopus","2-s2.0-85141953852"
"Hermes-Lima M.; Carreiro C.; Moreira D.C.; Polcheira C.; Machado D.P.; Campos T.G.","Hermes-Lima, Marcelo (7003603863); Carreiro, Cecília (55307543000); Moreira, Daniel C. (55308326300); Polcheira, Cássia (17135900300); Machado, Daniel P. (35999824200); Campos, Élida G. (56234121700)","7003603863; 55307543000; 55308326300; 17135900300; 35999824200; 56234121700","Glutathione status and antioxidant enzymes in a crocodilian species from the swamps of the Brazilian Pantanal","2012","Comparative Biochemistry and Physiology - A Molecular and Integrative Physiology","163","2","","189","198","9","17","10.1016/j.cbpa.2012.06.006","https://www.scopus.com/inward/record.uri?eid=2-s2.0-84864087578&doi=10.1016%2fj.cbpa.2012.06.006&partnerID=40&md5=c77bc8cce7b77d928f344d87b6c32b52","Antioxidant; Caiman yacare; Development; Glutathione; Oxidative stress","Animalia; Caiman; Caiman yacare; Crocodylidae (all crocodiles); catalase; glucose 6 phosphate dehydrogenase; glutathione; glutathione peroxidase; glutathione reductase; glutathione transferase; adolescent; animal tissue; article; brain; crocodilian; embryo; enzyme activity; glutathione metabolism; kidney; liver; lung; nonhuman; tissue level","Article","Final","All Open Access; Bronze Open Access","Scopus","2-s2.0-84864087578"
"Moreira D.C.; Welker A.F.; Campos É.G.; De Souza S.C.R.; Hermes-Lima M.","Moreira, Daniel C. (55308326300); Welker, Alexis F. (8585126900); Campos, Élida G. (56234121700); De Souza, Silvia Cristina R. (7102117070); Hermes-Lima, Marcelo (7003603863)","55308326300; 8585126900; 56234121700; 7102117070; 7003603863","Subtropical hibernation in juvenile tegu lizards (Salvator merianae): Insights from intestine redox dynamics","2018","Scientific Reports","8","1","9368","","","","8","10.1038/s41598-018-27263-x","https://www.scopus.com/inward/record.uri?eid=2-s2.0-85048951203&doi=10.1038%2fs41598-018-27263-x&partnerID=40&md5=1a81849cd2a82978094bc9c429c2f056","","Animals; Antioxidants; Catalase; Energy Metabolism; Glutathione; Glutathione Disulfide; Glutathione Peroxidase; Glutathione Reductase; Intestinal Mucosa; Lizards; Oxidation-Reduction; antioxidant; catalase; glutathione; glutathione disulfide; glutathione peroxidase; glutathione reductase; animal; energy metabolism; intestine mucosa; lizard; metabolism; oxidation reduction reaction; physiology","Article","Final","All Open Access; Gold Open Access; Green Open Access","Scopus","2-s2.0-85048951203"
"Vasconcelos A.G.; Barros A.L.A.N.; Cabral W.F.; Moreira D.C.; da Silva I.G.M.; Silva-Carvalho A.É.; de Almeida M.P.; Albuquerque L.F.F.; dos Santos R.C.; S. Brito A.K.; Saldanha-Araújo F.; Arcanjo D.D.R.; C. Martins M.C.; dos S. Borges T.K.; Báo S.N.; Plácido A.; Eaton P.; Kuckelhaus S.A.S.; Leite J.R.S.A.","Vasconcelos, Andreanne G. (57055189300); Barros, Ana Luisa A. N. (57327792500); Cabral, Wanessa F. (57126003500); Moreira, Daniel C. (55308326300); da Silva, Ingrid Gracielle M. (57211487516); Silva-Carvalho, Amandda É. (57204085906); de Almeida, Miguel P. (55189516000); Albuquerque, Lucas F. F. (57202609898); dos Santos, Raimunda C. (56723523300); S. Brito, Ana Karolinne (57327649100); Saldanha-Araújo, Felipe (25026388400); Arcanjo, Daniel D. R. (47861880200); C. Martins, Maria do Carmo (57327792600); dos S. Borges, Tatiana K. (57327933000); Báo, Sônia N. (7201558797); Plácido, Alexandra (55232677900); Eaton, Peter (7005831154); Kuckelhaus, Selma A. S. (8313515500); Leite, José Roberto S. A. (7201818325)","57055189300; 57327792500; 57126003500; 55308326300; 57211487516; 57204085906; 55189516000; 57202609898; 56723523300; 57327649100; 25026388400; 47861880200; 57327792600; 57327933000; 7201558797; 55232677900; 7005831154; 8313515500; 7201818325","Promising self-emulsifying drug delivery system loaded with lycopene from red guava (Psidium guajava L.): in vivo toxicity, biodistribution and cytotoxicity on DU-145 prostate cancer cells","2021","Cancer Nanotechnology","12","1","30","","","","10","10.1186/s12645-021-00103-w","https://www.scopus.com/inward/record.uri?eid=2-s2.0-85118747403&doi=10.1186%2fs12645-021-00103-w&partnerID=40&md5=d343a1c5f8020ef6ce1cfcb543ccc609","Antitumoral; Carotenoids; Guava fruit; Nanomedicine; Self-emulsifying","1,1 diphenyl 2 picrylhydrazyl; acetone; acetonitrile; alanine aminotransferase; alcohol; alkaline phosphatase; ammonium acetate; aspartate aminotransferase; buffer; chloroform; cholesterol; coconut oil; creatinine; dichloromethane; dimethyl sulfoxide; ficoll; formaldehyde; glucose; guava extract; hexane; lycopene; lycopene from red guava; methanol; phosphate buffered saline; polysorbate 80; propidium iodide; resin; triacylglycerol; trolox C; trypan blue; unclassified drug; uranyl acetate; urea; animal experiment; animal model; animal tissue; antioxidant activity; Article; biodistribution; controlled study; cytotoxicity; dispersity; drug bioavailability; drug delivery system; drug distribution; DU145 cell line; fetal bovine serum; flow cytometry; fluorescence microscopy; Fourier transform infrared spectroscopy; free radical scavenging assay; high performance liquid chromatography; histopathology; human; human cell; male; mouse; MTT assay; nanoemulsion; necrosis; nonhuman; peripheral blood mononuclear cell; photon correlation spectroscopy; physical chemistry; self emulsifying drug delivery system; Swiss Webster mouse; toxicity assay; transmission electron microscopy; ultraviolet visible spectrophotometry; zeta potential","Article","Final","All Open Access; Gold Open Access; Green Open Access","Scopus","2-s2.0-85118747403"
"Hermes-Lima M.; Moreira D.C.; Rivera-Ingraham G.A.; Giraud-Billoud M.; Genaro-Mattos T.C.; Campos É.G.","Hermes-Lima, Marcelo (7003603863); Moreira, Daniel C. (55308326300); Rivera-Ingraham, Georgina A. (24512535400); Giraud-Billoud, Maximiliano (24491821500); Genaro-Mattos, Thiago C. (35749681600); Campos, Élida G. (56234121700)","7003603863; 55308326300; 24512535400; 24491821500; 35749681600; 56234121700","Preparation for oxidative stress under hypoxia and metabolic depression: Revisiting the proposal two decades later","2015","Free Radical Biology and Medicine","89","","","1122","1143","21","145","10.1016/j.freeradbiomed.2015.07.156","https://www.scopus.com/inward/record.uri?eid=2-s2.0-84946593511&doi=10.1016%2fj.freeradbiomed.2015.07.156&partnerID=40&md5=e1777f959f95a831e8603691bf976d2e","Anoxia; Dehydration; Estivation; Freeze tolerance; Hypoxia tolerance; Ischemia","Animals; Humans; Hypoxia; Metabolic Networks and Pathways; Oxidative Stress; antioxidant; enzyme; free radical; lipid; reactive nitrogen species; reactive oxygen metabolite; transcription factor; aestivation; anoxia; dehydration; environmental stress; freezing; high temperature; hypoxia; lipid peroxidation; metabolic inhibition; nonhuman; oxidation reduction potential; oxidative stress; priority journal; protein synthesis; Review; animal; human; hypoxia; metabolism; pathophysiology","Review","Final","","Scopus","2-s2.0-84946593511"
