"Authors","Author full names","Author(s) ID","Title","Year","Source title","Volume","Issue","Art. No.","Page start","Page end","Page count","Cited by","DOI","Link","Abstract","Author Keywords","Index Keywords","Document Type","Publication Stage","Open Access","Source","EID"
"Moreira D.C.; Carvajalino-Fernández J.M.; Navas C.A.; de Carvalho J.E.; Hermes-Lima M.","Moreira, Daniel C. (55308326300); Carvajalino-Fernández, Juan M. (55909349600); Navas, Carlos A. (7003298478); de Carvalho, José E. (57221938300); Hermes-Lima, Marcelo (7003603863)","55308326300; 55909349600; 7003298478; 57221938300; 7003603863","Metabolic and Redox Biomarkers in Skeletal Muscle Underlie Physiological Adaptations of Two Estivating Anuran Species in a South American Semi-arid Environment","2021","Frontiers in Physiology","12","","769833","","","","6","10.3389/fphys.2021.769833","https://www.scopus.com/inward/record.uri?eid=2-s2.0-85121695293&doi=10.3389%2ffphys.2021.769833&partnerID=40&md5=aaaefc0b29ff2b391737f3afcf049f68","The upregulation of endogenous antioxidants (i.e., preparation for oxidative stress, POS) is part of the biochemical responses underlying the adaptation of animals to adverse environments. Despite the phylogenetic diversity of animals in which POS has been described, most studies focus on animals under controlled laboratory conditions. To address this limitation, we have recently assessed the redox metabolism in the skeletal muscle of Proceratophrys cristiceps estivating under natural settings in the Caatinga. Here, we analyzed biochemical biomarkers in the muscle of another Caatinga species, Pleurodema diplolister, during the rainy (active) and dry (estivating frogs) seasons. We aimed to determine whether P. diplolister enhances its antioxidants during estivation under field conditions and to identify any effect of species on the biochemical responses of P. diplolister and P. cristiceps associated with estivation. To do so, we measured the activities of representative enzymes of intermediary metabolism and antioxidant systems, as well as glutathione and protein carbonyl levels, in the skeletal muscle of P. diplolister. Our findings revealed the suppression of oxidative metabolism and activation of antioxidant enzymes in estivating P. diplolister compared with active specimens. No changes in oxidative damage to proteins were observed and estivating P. diplolister had lower levels of disulfide glutathione (GSSG) and disulfide-to-total glutathione ratio (GSSG/tGSH) than those observed in active individuals. When data for P. diplolister and P. cristiceps were assembled and analyzed, significant effects of species were detected on the activities of metabolic enzymes (citrate synthase, isocitric dehydrogenase, malic enzyme, and creatine kinase) and antioxidant enzymes (catalase, glutathione peroxidase and glutathione transferase), as well as on GSSG/tGSH ratio. Such effects might underlie the physiological and behavioral differences between these two species that share the same microhabitat and survival strategy (i.e., to estivate) during the dry season. Despite some peculiarities, which reflect the physiological diversity of the mechanisms associated with estivation in the Brazilian Caatinga, both P. diplolister and P. cristiceps seem to balance the suppression of oxidative pathways, the maintenance of the capacity of oxygen-independent pathways, and the activation of endogenous antioxidants to preserve muscle function and be ready to resume activity whenever the unpredictable rainy period arrives. Copyright © 2021 Moreira, Carvajalino-Fernández, Navas, de Carvalho and Hermes-Lima.","amphibia; antioxidant; Caatinga; glutathione; Pleurodema diplolister; preparation for oxidative stress; Proceratophrys cristiceps; reactive oxygen species","biological marker; carbonyl derivative; catalase; citrate synthase; creatine kinase; glutathione; glutathione disulfide; glutathione peroxidase; glutathione transferase; isocitrate dehydrogenase; malate dehydrogenase (decarboxylating); aerobic metabolism; aestivation; Anura; Article; dry season; enzyme activity; metabolic regulation; microhabitat; muscle function; muscle metabolism; nonhuman; oxidation reduction state; oxidative stress; phylogeny; Pleurodema diplolister; Proceratophrys cristiceps; rainy season; semiarid climate; skeletal muscle; species comparison; survival; temperature acclimatization","Article","Final","All Open Access; Gold Open Access; Green Open Access","Scopus","2-s2.0-85121695293"
"Moreira D.C.","Moreira, Daniel C. (55308326300)","55308326300","RGBradford: Protein Quantitation with a Smartphone Camera","2023","Journal of Visualized Experiments","2023","199","e65547","","","","0","10.3791/65547","https://www.scopus.com/inward/record.uri?eid=2-s2.0-85172194686&doi=10.3791%2f65547&partnerID=40&md5=6b8d612e67db968dc29b389eb1d64b0a","Protein quantitation is an essential procedure in life sciences research. Amongst several other methods, the Bradford assay is one of the most used. Because of its widespread, the limitations and advantages of the Bradford assay have been exhaustively reported, including several modifications of the original method to improve its performance. One of the alterations of the original method is the use of a smartphone camera as an analytical instrument. Taking advantage of the three forms of the Coomassie Brilliant Blue dye that exist in the conditions of the Bradford assay, this paper describes how to accurately quantify protein in samples using color data extracted from a single picture of a microplate. After performing the assay in a microplate, a picture is taken using a smartphone camera, and RGB color data is extracted from the picture using a free and open-source image analysis software application. Then, the ratio of blue to green intensity (in the RGB scale) of samples with unknown concentrations of protein is used to calculate the protein content based on a standard curve. No significant difference is observed between values calculated using RGB color data and those calculated using conventional absorbance data. © 2023 JoVE Journal of Visualized Experiments.","","Biological Assay; Image Processing, Computer-Assisted; Smartphone; Software; bioassay; image processing; software","Article","Final","","Scopus","2-s2.0-85172194686"
"Moreira D.C.; Zenteno-Savín T.; Hermes-Lima M.","Moreira, Daniel C. (55308326300); Zenteno-Savín, Tania (6602620228); Hermes-Lima, Marcelo (7003603863)","55308326300; 6602620228; 7003603863","Redox Metabolism in Ecophysiology and Evolution","2023","Antioxidants","12","9","1769","","","","0","10.3390/antiox12091769","https://www.scopus.com/inward/record.uri?eid=2-s2.0-85172221672&doi=10.3390%2fantiox12091769&partnerID=40&md5=a70b10760e60973244412fbfe88389e9","[No abstract available]","","","Editorial","Final","All Open Access; Gold Open Access","Scopus","2-s2.0-85172221672"
"Ferreira-Cravo M.; Moreira D.C.; Hermes-Lima M.","Ferreira-Cravo, Marlize (15126617300); Moreira, Daniel C. (55308326300); Hermes-Lima, Marcelo (7003603863)","15126617300; 55308326300; 7003603863","Glutathione Depletion Disrupts Redox Homeostasis in an Anoxia-Tolerant Invertebrate","2023","Antioxidants","12","6","1197","","","","5","10.3390/antiox12061197","https://www.scopus.com/inward/record.uri?eid=2-s2.0-85163887376&doi=10.3390%2fantiox12061197&partnerID=40&md5=2dd22875c86cfcdddb17b6e689a47613","The upregulation of endogenous antioxidants is a widespread phenomenon in animals that tolerate hypoxia/anoxia for extended periods. The identity of the mobilized antioxidant is often context-dependent and differs among species, tissues, and stresses. Thus, the contribution of individual antioxidants to the adaptation to oxygen deprivation remains elusive. This study investigated the role of glutathione (GSH) in the control of redox homeostasis under the stress of anoxia and reoxygenation in Helix aspersa, an animal model of anoxia tolerance. To do so, the total GSH (tGSH) pool was depleted with l-buthionine-(S, R)-sulfoximine (BSO) before exposing snails to anoxia for 6 h. Then, the concentration of GSH, glutathione disulfide (GSSG), and oxidative stress markers (TBARS and protein carbonyl) and the activity of antioxidant enzymes (catalase, glutathione peroxidase, glutathione transferase, glutathione reductase, and glucose 6-phosphate dehydrogenase) were measured in foot muscle and hepatopancreas. BSO alone induced tGSH depletion by 59–75%, but no other changes happened in other variables, except for foot GSSG. Anoxia elicited a 110–114% increase in glutathione peroxidase in the foot; no other changes occurred during anoxia. However, GSH depletion before anoxia increased the GSSG/tGSH ratio by 84–90% in both tissues, which returned to baseline levels during reoxygenation. Our findings indicate that glutathione is required to withstand the oxidative challenge induced by hypoxia and reoxygenation in land snails. © 2023 by the authors.","hypoxia; ischemia; preparation for oxidative stress; reoxygenation; reperfusion","","Article","Final","All Open Access; Gold Open Access; Green Open Access","Scopus","2-s2.0-85163887376"
"Moreira D.C.","Moreira, Daniel C. (55308326300)","55308326300","RGBradford: Accurate measurement of protein concentration using a smartphone camera and the blue to green intensity ratio","2022","Analytical Biochemistry","655","","114839","","","","6","10.1016/j.ab.2022.114839","https://www.scopus.com/inward/record.uri?eid=2-s2.0-85137068768&doi=10.1016%2fj.ab.2022.114839&partnerID=40&md5=ffbb9d2a391716099e76487f88b6f772","The color shift caused by the interaction between proteins and Coomassie Brilliant Blue in the Bradford assay can be recorded with a smartphone camera. Color data can then be extracted from pictures and processed as analytical signals. Here, I present a simple procedure to accurately measure protein levels using color data from pictures of microplates. Plotting the ratio of blue to green intensity (RGB scale) as a function of protein concentration results in a linear (R2 ≥ 0.99) relationship, from which protein levels in biological samples can be calculated with no significant difference from values obtained using absorbance data (RGB versus absorbance curves). © 2022 Elsevier Inc.","Colorimetry; Coomassie Brilliant Blue; Digital image analysis; Mobile phone; Portable instrumentation; Spectrophotometry","Colorimetry; Proteins; Smartphone; Cameras; Colorimetry; Proteins; Smartphones; brilliant blue g; protein; protein; Accurate measurement; Color shifts; Coomassie Brilliant Blue; Digital image analysis; Intensity ratio; Measurements of; Portable instrumentation; Protein concentrations; Protein level; Smart-phone cameras; animal cell; Article; BV-2 cell line; Galleria mellonella; image analysis; microglia; nonhuman; protein analysis; protein content; protein function; spectrophotometry; colorimetry; procedures; smartphone; Color","Article","Final","","Scopus","2-s2.0-85137068768"
"Dalvi L.T.; Moreira D.C.; Andrade R., Jr.; Ginani J.; Alonso A.; Hermes-Lima M.","Dalvi, Luana T. (8314931800); Moreira, Daniel C. (55308326300); Andrade, Roberto (57211972437); Ginani, Janini (14624794700); Alonso, Antonio (7402478359); Hermes-Lima, Marcelo (7003603863)","8314931800; 55308326300; 57211972437; 14624794700; 7402478359; 7003603863","Ellagic acid inhibits iron-mediated free radical formation","2017","Spectrochimica Acta - Part A: Molecular and Biomolecular Spectroscopy","173","","","910","917","7","33","10.1016/j.saa.2016.10.034","https://www.scopus.com/inward/record.uri?eid=2-s2.0-84994834801&doi=10.1016%2fj.saa.2016.10.034&partnerID=40&md5=8e99f7e7b968310d4edbc727702d1bff","Polyphenols are reported to have some health benefits, which are link to their antioxidant properties. In the case of ellagic acid (EA), there is evidence that it has free radical scavenger properties and that it is able to form complexes with metal ions. However, information on a possible link between the formation of iron-EA complexes and their interference in Haber-Weiss/Fenton reactions was not yet determined. Thus, the present study investigated the in vitro antioxidant mechanism of EA in a system containing ascorbate, Fe(III) and different iron ligands (EDTA, citrate and NTA). Iron-mediated oxidative degradation of 2-deoxyribose was poorly inhibited (by 12%) in the presence of EA (50 μM) and EDTA. When citrate or NTA - which form weak iron complexes - were used, the 2-deoxyribose protection increased to 89–97% and 45%, respectively. EA also presented equivalent inhibitory effects on iron-mediated oxygen uptake and ascorbyl radical formation. Spectral analyses of iron-EA complexes show that EA removes Fe(III) from EDTA within hours, and from citrate within 1 min. This difference in the rate of iron-EA complex formation may explain the antioxidant effects of EA. Furthermore, the EA antioxidant effectiveness was inversely proportional to the Fe(III) concentration, suggesting a competition with EDTA. In conclusion, the results indicate that EA may prevent in vitro free radical formation when it forms a complex with iron ions. © 2016 Elsevier B.V.","Antioxidant; Ellagic acid; Free radical; Iron; Polyphenol","Antioxidants; Ellagic acid; Free radicals; Iron; Iron analysis; Metal ions; Metals; Spectrum analysis; Antioxidant effect; Antioxidant mechanisms; Antioxidant properties; Complex formations; Free radical scavengers; Inhibitory effect; Oxidative degradation; Polyphenols; Iron compounds","Article","Final","","Scopus","2-s2.0-84994834801"
"Cancelarich N.L.; Arrulo M.; Gugliotti S.T.; Barbosa E.A.; Moreira D.C.; Basso N.G.; Pérez L.O.; Teixeira C.; Gomes P.; de la Torre B.G.; Albericio F.; Eaton P.; Leite J.R.S.A.; Marani M.M.","Cancelarich, Natalia L. (57204597794); Arrulo, Miriam (59182312100); Gugliotti, Sariah Trillo (59182633100); Barbosa, Eder A (14044592700); Moreira, Daniel C. (55308326300); Basso, Néstor G. (7005272210); Pérez, Luis Orlando (57203047122); Teixeira, Cátia (23981482200); Gomes, Paula (7102879822); de la Torre, Beatriz G. (7004676510); Albericio, Fernando (7005138070); Eaton, Peter (7005831154); Leite, José R. S. A. (57811416300); Marani, Mariela M. (56734259800)","57204597794; 59182312100; 59182633100; 14044592700; 55308326300; 7005272210; 57203047122; 23981482200; 7102879822; 7004676510; 7005138070; 7005831154; 57811416300; 56734259800","First Bioprospecting Study of Skin Host-Defense Peptides in Odontophrynus americanus","2024","Journal of Natural Products","87","7","","1714","1724","10","0","10.1021/acs.jnatprod.4c00184","https://www.scopus.com/inward/record.uri?eid=2-s2.0-85196632360&doi=10.1021%2facs.jnatprod.4c00184&partnerID=40&md5=af74a2dcf7c62a3f21d8ac91f05ec7a0","The adaptation of amphibians to diverse environments is closely related to the characteristics of their skin. The complex glandular system of frog skin plays a pivotal role in enabling these animals to thrive in both aquatic and terrestrial habitats and consists of crucial functions such as respiration and water balance as well as serving as a defensive barrier due to the secretion of bioactive compounds. We herein report the first investigation on the skin secretion of Odontophrynus americanus, as a potential source of bioactive peptides and also as an indicator of its evolutionary adaptations to changing environments. Americanin-1 was isolated and identified as a neutral peptide exhibiting moderate antibacterial activity against E. coli. Its amphipathic sequence including 19 amino acids and showing a propensity for α-helix structure is discussed. Comparisons of the histomorphology of the skin of O. americanus with other previously documented species within the same genus revealed distinctive features in the Patagonian specimen, differing from conspecifics from other Argentine provinces. The presence of the Eberth-Katschenko layer, a prevalence of iridophores, and the existence of glycoconjugates in its serous glands suggest that the integument is adapted to retain skin moisture. This adaptation is consistent with the prevailing aridity of its native habitat. © 2024 American Chemical Society and American Society of Pharmacognosy.","","Amino Acid Sequence; Animals; Anti-Bacterial Agents; Antimicrobial Peptides; Anura; Argentina; Escherichia coli; Microbial Sensitivity Tests; Molecular Structure; Peptides; Skin; antiinfective agent; peptide; polypeptide antibiotic agent; amino acid sequence; animal; Anura; Argentina; chemical structure; chemistry; drug effect; Escherichia coli; microbial sensitivity test; skin","Article","Final","","Scopus","2-s2.0-85196632360"
"Paula J.R.; Wang X.; Xu C.; Moreira D.C.","Paula, José Ricardo (57345738700); Wang, Xiaodan (54950564100); Xu, Chang (56709079800); Moreira, Daniel C. (55308326300)","57345738700; 54950564100; 56709079800; 55308326300","Editorial: The defense responses of aquatic animals to the environment","2023","Frontiers in Physiology","14","","1231014","","","","0","10.3389/fphys.2023.1231014","https://www.scopus.com/inward/record.uri?eid=2-s2.0-85163172063&doi=10.3389%2ffphys.2023.1231014&partnerID=40&md5=a2d041d87502477b3252125d6ae11033","[No abstract available]","environmental stressor; hydrogen sulfide; non-essential element; osmoregulation; pH variation; ultraviolet radiation","hydrogen sulfide; mucin; altitude; aquatic environment; aquatic species; Editorial; nonhuman; oxidative stress; ultraviolet radiation","Editorial","Final","All Open Access; Gold Open Access; Green Open Access","Scopus","2-s2.0-85163172063"
"Geihs M.A.; Moreira D.C.; López-Martínez G.; Minari M.; Ferreira-Cravo M.; Carvajalino-Fernández J.M.; Hermes-Lima M.","Geihs, Márcio A. (23097568800); Moreira, Daniel C. (55308326300); López-Martínez, Giancarlo (15760277300); Minari, Marina (57211394761); Ferreira-Cravo, Marlize (15126617300); Carvajalino-Fernández, Juan Manuel (55909349600); Hermes-Lima, Marcelo (7003603863)","23097568800; 55308326300; 15760277300; 57211394761; 15126617300; 55909349600; 7003603863","Commentary: Ultraviolet radiation triggers “preparation for oxidative stress” antioxidant response in animals: Similarities and interplay with other stressors","2020","Comparative Biochemistry and Physiology -Part A : Molecular and Integrative Physiology","239","","110585","","","","13","10.1016/j.cbpa.2019.110585","https://www.scopus.com/inward/record.uri?eid=2-s2.0-85073749113&doi=10.1016%2fj.cbpa.2019.110585&partnerID=40&md5=6658fccf12b9a544aafb1d487437bb7b","Preparation for oxidative stress (POS), i.e., the upregulation of endogenous antioxidants, is a widespread response of animals exposed to extreme conditions. This response has been described for more than 80 animal species belonging to eight phyla during hypometabolism or situations that limit oxygen availability. The pattern of the typical POS-response, in which a mild redox imbalance triggers antioxidant adjustments that results in increased tolerance to subsequent oxidative insults, roughly follows the curve of hormetic phenomena. A similar pattern has been reported for various animal species exposed to ultraviolet radiation (UVR) – these studies, on animals from six phyla, are discussed herein. In the light of the similarities in the redox-response of animals exposed to either oxygen restriction or UVR, we argue in this essay that UVR elicits a type of response that fits the POS theory. Exposure to UVR induces both reactive species formation and antioxidant adaptation, which is the essence of typical POS-responses. Thus, antioxidant response to UVR in animals can be categorized as a POS-type mechanism. Moreover, considering that animals are exposed to multiple stressors simultaneously in nature, this would represent an ecologically relevant process, by which one stressor (e.g., UV or ionizing radiation) may enhance the tolerance to other. We also discuss a possible role of low doses of ionizing radiation as inductor of POS-like responses in animals. © 2019","Aquatic animals; Electromagnetic; Free radical; Glutathione; Hormesis; Wavelength","Adaptation, Physiological; Animals; Antioxidants; Oxidation-Reduction; Oxidative Stress; Stress, Physiological; Ultraviolet Rays; oxygen; antioxidant; controlled study; ionizing radiation; mitochondrion; nonhuman; Note; oxidation reduction state; oxidative stress; radiation dose; redox stress; reoxygenation; ultraviolet radiation; adaptation; adverse event; animal; metabolism; oxidation reduction reaction; oxidative stress; physiological stress; radiation response; ultraviolet radiation","Note","Final","","Scopus","2-s2.0-85073749113"
"Welker A.F.; Moreira D.C.; Campos T.G.; Hermes-Lima M.","Welker, Alexis F. (8585126900); Moreira, Daniel C. (55308326300); Campos, Élida G. (56234121700); Hermes-Lima, Marcelo (7003603863)","8585126900; 55308326300; 56234121700; 7003603863","Role of redox metabolism for adaptation of aquatic animals to drastic changes in oxygen availability","2013","Comparative Biochemistry and Physiology - A Molecular and Integrative Physiology","165","4","","384","404","20","149","10.1016/j.cbpa.2013.04.003","https://www.scopus.com/inward/record.uri?eid=2-s2.0-84891613757&doi=10.1016%2fj.cbpa.2013.04.003&partnerID=40&md5=8f373a84e7697ebae205608c34990565","Large changes in oxygen availability in aquatic environments, ranging from anoxia through to hyperoxia, can lead to corresponding wide variation in the production of reactive oxygen species (ROS) by animals with aquatic respiration. Therefore, animals living in marine, estuarine and freshwater environments have developed efficient antioxidant defenses to minimize oxidative stress and to regulate the cellular actions of ROS. Changes in oxygen levels may lead to bursts of ROS generation that can be particularly harmful. This situation is commonly experienced by aquatic animals during abrupt transitions from periods of hypoxia/anoxia back to oxygenated conditions (e.g. intertidal cycles). The strategies developed differ significantly among aquatic species and are (i) improvement of their endogenous antioxidant system under hyperoxia (that leads to increased ROS formation) or other similar ROS-related stresses, (ii) increase in antioxidant levels when displaying higher metabolic rates, (iii) presence of constitutively high levels of antioxidants, that attenuates oxidative stress derived from fluctuations in oxygen availability, or (iv) increase in the activity of antioxidant enzymes (and/or the levels of their mRNAs) during hypometabolic states associated with anoxia/hypoxia. This enhancement of the antioxidant system - coined over a decade ago as ""preparation for oxidative stress"" - controls the possible harmful effects of increased ROS formation during hypoxia/reoxygenation. The present article proposes a novel explanation for the biochemical and molecular mechanisms involved in this phenomenon that could be triggered by hypoxia-induced ROS formation. We also discuss the connections among oxygen sensing, oxidative damage and regulation of the endogenous antioxidant defense apparatus in animals adapted to many natural or man-made challenges of the aquatic environment. © 2013 Elsevier Inc.","Anoxia; Antioxidants; Hypoxia; Oxidative stress; Oxygen sensing","Adaptation, Biological; Animals; Antioxidants; Environment; Humans; Hydrobiology; Oxidation-Reduction; Oxidative Stress; Oxygen; Reactive Oxygen Species; Respiration; Animalia; antioxidant; free radical; hypoxia inducible factor 1; messenger RNA; oxygen; protein p53; reactive oxygen metabolite; transcription factor Nrf2; oxygen; reactive oxygen metabolite; antioxidant; reactive oxygen metabolite; adaptation; anoxia; antioxidant activity; aquatic environment; aquatic species; bioavailability; hypoxia; metabolic rate; nitrogen availability; nonhuman; oxidative stress; oxygen sensing; protein expression; regulatory mechanism; reoxygenation; review; animal; biology; breathing; environment; human; metabolism; oxidation reduction reaction; metabolism","Review","Final","","Scopus","2-s2.0-84891613757"
