"Authors","Author full names","Author(s) ID","Title","Year","Source title","Volume","Issue","Art. No.","Page start","Page end","Page count","Cited by","DOI","Link","Abstract","Author Keywords","Index Keywords","Document Type","Publication Stage","Open Access","Source","EID"
"Farias J.P.; Barros A.L.A.N.; de Araújo-Nobre A.R.; Sobrinho-Júnior E.P.C.; Alves M.M.D.M.; Carvalho F.A.D.A.; da Franca Rodrigues K.A.; de Andrade I.M.; Silva-Filho F.A.E.; Moreira D.C.; Lima D.F.; Lucarini M.; Durazzo A.; Arcanjo D.D.R.; de Souza de Almeida Leite J.R.","Farias, Jéssica Pires (57658603700); Barros, Ana Luisa Alves Nogueira (57327792500); de Araújo-Nobre, Alyne Rodrigues (57209182371); Sobrinho-Júnior, Enoque Pereira Costa (57191198059); Alves, Michel Muálem de Moraes (57195312945); Carvalho, Fernando Aécio de Amorim (54884929500); da Franca Rodrigues, Klinger Antonio (57209685374); de Andrade, Ivanilza Moreira (55491152500); Silva-Filho, Francisco Artur e (58122003700); Moreira, Daniel Carneiro (55308326300); Lima, David Fernandes (54581194800); Lucarini, Massimo (7004303581); Durazzo, Alessandra (57214847341); Arcanjo, Daniel Dias Rufino (47861880200); de Souza de Almeida Leite, José Roberto (7201818325)","57658603700; 57327792500; 57209182371; 57191198059; 57195312945; 54884929500; 57209685374; 55491152500; 58122003700; 55308326300; 54581194800; 7004303581; 57214847341; 47861880200; 7201818325","Influence of Plant Age on Chemical Composition, Antimicrobial Activity and Cytotoxicity of Varronia curassavica Jacq. Essential Oil Produced on an Industrial Scale","2023","Agriculture (Switzerland)","13","2","373","","","","2","10.3390/agriculture13020373","https://www.scopus.com/inward/record.uri?eid=2-s2.0-85149150962&doi=10.3390%2fagriculture13020373&partnerID=40&md5=8c91e4cd50ca0540f1be2fe8c9be9a34","Considering the therapeutic potential of Varronia curassavica Jacq. essential oil and the great value in the pharmaceutical market, this study aims to evaluate the influence of plant age on the chemical composition and biological activities of V. curassavica Jacq. essential oil. The plant age is a parameter that can influence the chemical composition of the essential oil, as well as its pharmacological potential. For this purpose, essential oils from aerial parts of V. curassavica produced at different ages (4, 10, 14 and 18 months-age) were used. According to chromatograms obtained by GC-MS, the essential oils were mainly composed of α-pinene, trans-caryophyllene, α-santalene, alloaromadendrene and α-humulene. The chemical composition of V. curassavica essential oils varied qualitatively and quantitatively with the aging of the plants, and the essential oils from plants at 18 month-age appeared to be the most distinct from the others. The tested essential oil samples showed inhibitory activity against Candida albicans (MIC = 1000 µg/mL) but did not show antibacterial activity against the tested bacteria. The cytotoxic activity levels against the murine macrophages varied among the oils extracted from the plants at different ages; the IC50 values of the essential oils increased with age (171.90 µg/mL at 18 month-age). More studies should be carried out to assess whether age also affects the therapeutic effects of essential oils, resulting in the manufacture of plant-derived formulations that balance production costs, toxicity and therapeutic effects. © 2023 by the authors.","antifungal; Cordia verbenacea; cytotoxicity; essential oil; GC/MS; medicinal plant","","Article","Final","All Open Access; Gold Open Access","Scopus","2-s2.0-85149150962"
"Cancelarich N.L.; Wilke N.; Fanani M.L.; Moreira D.C.; Pérez L.O.; Alves Barbosa E.; Plácido A.; Socodato R.; Portugal C.C.; Relvas J.B.; de la Torre B.G.; Albericio F.; Basso N.G.; Leite J.R.; Marani M.M.","Cancelarich, Natalia L. (57204597794); Wilke, Natalia (7004661397); Fanani, Marı́a L. (7801537711); Moreira, Daniel C. (55308326300); Pérez, Luis O. (57203047122); Alves Barbosa, Eder (57215687534); Plácido, Alexandra (55232677900); Socodato, Renato (57195332931); Portugal, Camila C. (57216326335); Relvas, João B. (6602197103); de la Torre, Beatriz G. (7004676510); Albericio, Fernando (7005138070); Basso, Néstor G. (7005272210); Leite, José R. (7201818325); Marani, Mariela M. (56734259800)","57204597794; 7004661397; 7801537711; 55308326300; 57203047122; 57215687534; 55232677900; 57195332931; 57216326335; 6602197103; 7004676510; 7005138070; 7005272210; 7201818325; 56734259800","Somuncurins: Bioactive Peptides from the Skin of the Endangered Endemic Patagonian Frog Pleurodema somuncurense","2020","Journal of Natural Products","83","4","","972","984","12","9","10.1021/acs.jnatprod.9b00906","https://www.scopus.com/inward/record.uri?eid=2-s2.0-85081643394&doi=10.1021%2facs.jnatprod.9b00906&partnerID=40&md5=560e96da3329805a4fe286bd9aa73efa","The skin glands of amphibian species hold a major component of their innate immunity, namely a unique set of antimicrobial peptides (AMPs). Although most of them have common characteristics, differences in AMP sequences allow a huge repertoire of biological activity with varying degrees of efficacy. We present the first study of the AMPs from Pleurodema somuncurence (Anura: Leptodactylidae: Leiuperinae). Among the 11 identified mature peptides, three presented antimicrobial activity. Somuncurin-1 (FIIWPLRYRK), somuncurin-2 (FILKRSYPQYY), and thaulin-3 (NLVGSLLGGILKK) inhibited Escherichia coli growth. Somuncurin-1 also showed antimicrobial activity against Staphylococcus aureus. Biophysical membrane model studies revealed that this peptide had a greater permeation effect in prokaryotic-like membranes and capacity to restructure liposomes, suggesting fusogenic activity, which could lead to cell aggregation and disruption of cell morphology. This study contributes to the characterization of peptides with new sequences to enrich the databases for the design of therapeutic agents. Furthermore, it highlights the importance of investing in nature conservation and the power of genetic description as a strategy to identify new compounds. Copyright © 2020 American Chemical Society and American Society of Pharmacognosy.","","Bioactivity; Conservation; Escherichia coli; Liposomes; Staphylococcus aureus; Amphibian species; Anti-microbial activity; Antimicrobial peptide; Bioactive peptides; Cell aggregation; Escherichia coli growths; Membrane modeling; Therapeutic agents; Peptides","Review","Final","","Scopus","2-s2.0-85081643394"
"Barbosa E.A.; Oliveira A.; Plácido A.; Socodato R.; Portugal C.C.; Mafud A.C.; Ombredane A.S.; Moreira D.C.; Vale N.; Bessa L.J.; Joanitti G.A.; Alves C.; Gomes P.; Delerue-Matos C.; Mascarenhas Y.P.; Marani M.M.; Relvas J.B.; Pintado M.; Leite J.R.S.A.","Barbosa, Eder Alves (14044592700); Oliveira, Ana (57222002286); Plácido, Alexandra (55232677900); Socodato, Renato (57195332931); Portugal, Camila C. (57216326335); Mafud, Ana Carolina (36801939700); Ombredane, Alicia S. (56403199900); Moreira, Daniel C. (55308326300); Vale, Nuno (23037309600); Bessa, Lucinda J. (37092470400); Joanitti, Graziella A. (14060375800); Alves, Cláudia (57214262888); Gomes, Paula (7102879822); Delerue-Matos, Cristina (6603741848); Mascarenhas, Yvonne Primerano (7003310927); Marani, Mariela M. (56734259800); Relvas, João B. (6602197103); Pintado, Manuela (7004483898); Leite, José Roberto S.A. (7201818325)","14044592700; 57222002286; 55232677900; 57195332931; 57216326335; 36801939700; 56403199900; 55308326300; 23037309600; 37092470400; 14060375800; 57214262888; 7102879822; 6603741848; 7003310927; 56734259800; 6602197103; 7004483898; 7201818325","Structure and function of a novel antioxidant peptide from the skin of tropical frogs","2018","Free Radical Biology and Medicine","115","","","68","79","11","51","10.1016/j.freeradbiomed.2017.11.001","https://www.scopus.com/inward/record.uri?eid=2-s2.0-85034997591&doi=10.1016%2fj.freeradbiomed.2017.11.001&partnerID=40&md5=2e6f6ab5a026f2c5a205d07aa52b7497","                             The amphibian skin plays an important role protecting the organism from external harmful factors such as microorganisms or UV radiation. Based on biorational strategies, many studies have investigated the cutaneous secretion of anurans as a source of bioactive molecules. By a peptidomic approach, a novel antioxidant peptide (AOP) with in vitro free radical scavenging ability was isolated from Physalaemus nattereri. The AOP, named antioxidin-I, has a molecular weight [M+H]                             +                              = 1543.69 Da and a TWYFITPYIPDK primary amino acid sequence. The gene encoding the antioxidin-I precursor was expressed in the skin tissue of three other Tropical frog species: Phyllomedusa tarsius, P. distincta and Pithecopus rohdei. cDNA sequencing revealed highly homologous regions (signal peptide and acidic region). Mature antioxidin-I has a novel primary sequence with low similarity compared with previously described amphibian's AOPs. Antioxidin-I adopts a random structure even at high concentrations of hydrophobic solvent, it has poor antimicrobial activity and poor performance in free radical scavenging assays in vitro, with the exception of the ORAC assay. However, antioxidin-I presented a low cytotoxicity and suppressed menadione-induced redox imbalance when tested with fibroblast in culture. In addition, it had the capacity to substantially attenuate the hypoxia-induced production of reactive oxygen species when tested in hypoxia exposed living microglial cells, suggesting a potential neuroprotective role for this peptide.                          © 2017 Elsevier Inc.","Amphibia; Antioxidant peptide; Antioxidin; Microglia; Reactive oxygen species; Skin secretion","Amphibian Proteins; Animals; Antimicrobial Cationic Peptides; Antioxidants; Anura; Bacterial Infections; Cloning, Molecular; Fibroblasts; Free Radical Scavengers; Mice; Microglia; Molecular Structure; Neuroprotection; NIH 3T3 Cells; Oxidation-Reduction; Protein Conformation; Reactive Oxygen Species; Skin; antioxidin I; antioxidin RP1; menadione; peptide; reactive oxygen metabolite; unclassified drug; amphibian protein; antimicrobial cationic peptide; antioxidant; reactive oxygen metabolite; scavenger; amino acid sequence; animal cell; antibacterial activity; antioxidant activity; Anura; Article; cell hypoxia; cell viability; computer model; controlled study; cytotoxicity; drug isolation; drug purification; drug structure; drug synthesis; embryo; Enterococcus faecalis; Escherichia coli; fibroblast culture; human; human cell; in vitro study; microglia; minimum bactericidal concentration; minimum inhibitory concentration; molecular weight; mouse; neuroprotection; nonhuman; ORAC assay; oxidation reduction state; peptidomics; Phyllomedusa distincta; Phyllomedusa tarsius; Physalaemus nattereri; Pithecopus rohdei; priority journal; Pseudomonas aeruginosa; Staphylococcus aureus; animal; bacterial infection; chemical structure; fibroblast; genetics; immunology; metabolism; molecular cloning; NIH 3T3 cell line; oxidation reduction reaction; physiology; protein conformation; skin","Article","Final","","Scopus","2-s2.0-85034997591"
"Moreira D.C.; Wang Y.; López-Martínez G.; Hermes-Lima M.","Moreira, Daniel C. (55308326300); Wang, Youji (22959076400); López-Martínez, Giancarlo (15760277300); Hermes-Lima, Marcelo (7003603863)","55308326300; 22959076400; 15760277300; 7003603863","Editorial: Redox Metabolism in Environmental and Ecological Physiology of Animals","2022","Frontiers in Physiology","13","","904746","","","","0","10.3389/fphys.2022.904746","https://www.scopus.com/inward/record.uri?eid=2-s2.0-85129904084&doi=10.3389%2ffphys.2022.904746&partnerID=40&md5=2fc101ec9a06ae4436bf9cc4d1c47e3d","[No abstract available]","antioxidant; dehydration; estivation; oxidative stress; radiation; reactive oxygen species; reproduction","antioxidant; biological marker; chaperone; glutathione; hydrogen peroxide; protein p53; reactive oxygen metabolite; reduced nicotinamide adenine dinucleotide phosphate oxidase; selenocysteine; somatomedin C; transcription factor; transcription factor FOXO; aestivation; cell death; colony formation; cyanobacterium; depression; ecology; Editorial; environmental factor; Eurytemora affinis; gene expression; nonhuman; Oreochromis niloticus; Oryzias latipes; oxidation reduction reaction; oxidative stress; physiology; Pomacea canaliculata; redox signaling; reproduction; signal transduction; upregulation","Editorial","Final","All Open Access; Gold Open Access; Green Open Access","Scopus","2-s2.0-85129904084"
"Barbosa E.A.; Plácido A.; Moreira D.C.; Albuquerque L.; Dematei A.; Silva-Carvalho A.É.; Cabral W.F.; Báo S.N.; Saldanha-Araújo F.; Kuckelhaus S.A.S.; Borges T.K.; Portugal C.C.; Socodato R.; Teixeira C.; Lima F.C.D.A.; Batagin-Neto A.; Sebben A.; Eaton P.; Gomes P.; Brand G.D.; Relvas J.B.; Kato M.J.; Leite J.R.S.A.","Barbosa, Eder Alves (14044592700); Plácido, Alexandra (55232677900); Moreira, Daniel C. (55308326300); Albuquerque, Lucas (57202609898); Dematei, Anderson (57195954021); Silva-Carvalho, Amandda É. (57204085906); Cabral, Wanessa F. (57126003500); Báo, Sonia N. (7201558797); Saldanha-Araújo, Felipe (25026388400); Kuckelhaus, Selma A. S. (8313515500); Borges, Tatiana K. (56465595400); Portugal, Camila C. (57216326335); Socodato, Renato (57195332931); Teixeira, Cátia (23981482200); Lima, Filipe Camargo D. A. (56052811600); Batagin-Neto, Augusto (15069371100); Sebben, Antônio (6602224564); Eaton, Peter (7005831154); Gomes, Paula (7102879822); Brand, Guilherme D. (8639196800); Relvas, Joao B. (6602197103); Kato, Massuo J. (7406306098); Leite, Jose Roberto S. A. (7201818325)","14044592700; 55232677900; 55308326300; 57202609898; 57195954021; 57204085906; 57126003500; 7201558797; 25026388400; 8313515500; 56465595400; 57216326335; 57195332931; 23981482200; 56052811600; 15069371100; 6602224564; 7005831154; 7102879822; 8639196800; 6602197103; 7406306098; 7201818325","The peptide secreted at the water to land transition in a model amphibian has antioxidant effects","2021","Proceedings of the Royal Society B: Biological Sciences","288","1962","20211531","","","","8","10.1098/rspb.2021.1531","https://www.scopus.com/inward/record.uri?eid=2-s2.0-85119997100&doi=10.1098%2frspb.2021.1531&partnerID=40&md5=28b62d30ae893e92cc1f61a1a72d031b","In addition to the morphophysiological changes experienced by amphibians during metamorphosis, they must also deal with a different set of environmental constraints when they shift from the water to the land. We found that Pithecopus azureus secretes a single peptide ([M + H]+ = 658.38 Da) at the developmental stage that precedes the onset of terrestrial behaviour. De novo peptide and cDNA sequencing revealed that the peptide, named PaT-2, is expressed in tandem and is a member of the tryptophyllins family. In silico studies allowed us to identify the position of reactive sites and infer possible antioxidant mechanisms of the compounds. Cell-based assays confirmed the predicted antioxidant activity in mammalian microglia and neuroblast cells. The potential neuroprotective effect of PaT-2 was further corroborated in FRET-based live cell imaging assays, where the peptide prevented lipopolysaccharide-induced ROS production and glutamate release in human microglia. In summary, PaT-2 is the first peptide expressed during the ontogeny of P. azureus, right before the metamorphosing froglet leaves the aquatic environment to occupy terrestrial habitats. The antioxidant activity of PaT-2, predicted by in silico analyses and confirmed by cell-based assays, might be relevant for the protection of the skin of P. azureus adults against increased O 2 levels and UV exposure on land compared with aquatic environments. © 2021 The Author(s).","Amphibia; antioxidant peptide; MALDI mass spectrometry imaging; oxidative stress; Pithecopus azureus; tryptophyllin","Animals; Antioxidants; Anura; Humans; Mammals; Peptides; Skin; Water; Amphibia; Mammalia; antioxidant; peptide; water; antioxidant; aquatic environment; developmental stage; frog; ontogeny; peptide; physiology; secretion; animal; Anura; human; mammal; physiology; skin","Article","Final","All Open Access; Green Open Access","Scopus","2-s2.0-85119997100"
"Cubas Rolim E.; Martins de Oliveira J.; Dalvi L.T.; Moreira D.C.; Garcia Caldas N.; Fernandes Lobo F.; André Polli D.; Campos É.G.; Hermes-Lima M.","Cubas Rolim, Estêvão (57192297213); Martins de Oliveira, Julia (57192295648); Dalvi, Luana T. (8314931800); Moreira, Daniel C. (55308326300); Garcia Caldas, Natasha (56650915300); Fernandes Lobo, Felipe (57192296517); André Polli, Démerson (6603259330); Campos, Élida G. (56234121700); Hermes-Lima, Marcelo (7003603863)","57192297213; 57192295648; 8314931800; 55308326300; 56650915300; 57192296517; 6603259330; 56234121700; 7003603863","Blog construction as an effective tool in biochemistry active learning","2017","Biochemistry and Molecular Biology Education","45","3","","205","215","10","2","10.1002/bmb.21028","https://www.scopus.com/inward/record.uri?eid=2-s2.0-85003549271&doi=10.1002%2fbmb.21028&partnerID=40&md5=82947c93fa23b73c722c41e09f19fddd","To boost active learning in undergraduate students, they were given the task of preparing blogs on topics of clinical biochemistry. This “experiment” lasted for 12 teaching-semesters (from 2008 to 2013), and included a survey on the blogs' usefulness at the end of each semester. The survey (applied in the 2008-2010 period) used a Likert-like questionnaire with eight questions and a 1-to-6 scale, from “totally disagree” to “fully agree.” Answers of 428 students were analyzed and indicated overall approval of the blog activity: 86% and 35% of the responses scored 4-to-6 and 6, respectively. Considering the survey results, the high grades obtained by students on their blogs (averaging 8.3 in 2008–2010), and the significant increase in average grades of the clinical biochemistry exam after the beginning of the blog system (from 5.5 in 2007 to 6.4 in 2008–2010), we concluded that blogging activity on biochemistry is a promising tool for boosting active learning. © 2016 by The International Union of Biochemistry and Molecular Biology, 45(3):205–215, 2017. © 2016 The International Union of Biochemistry and Molecular Biology","active learning; Education 2.0; medicine; metabolism; nutrition","Biochemistry; Blogging; Education, Medical, Undergraduate; Humans; Internet; Problem-Based Learning; Students; Surveys and Questionnaires; biochemistry; blogging; classification; education; human; Internet; medical education; problem based learning; questionnaire; statistics and numerical data; student","Article","Final","All Open Access; Bronze Open Access","Scopus","2-s2.0-85003549271"
"Campelo Y.; Ombredane A.; Vasconcelos A.G.; Albuquerque L.; Moreira D.C.; Plácido A.; Rocha J.; Fokoue H.H.; Yamaguchi L.; Mafud A.; Mascarenhas Y.P.; Delerue-Matos C.; Borges T.; Joanitti G.A.; Arcanjo D.; Kato M.J.; Kuckelhaus S.A.S.; Silva M.P.N.; de Moraes J.; Leite J.R.S.A.","Campelo, Yuri (55204819300); Ombredane, Alicia (56403199900); Vasconcelos, Andreanne G. (57055189300); Albuquerque, Lucas (57202609898); Moreira, Daniel C. (55308326300); Plácido, Alexandra (55232677900); Rocha, Jefferson (57186187900); Fokoue, Harold Hilarion (55440133800); Yamaguchi, Lydia (8780177200); Mafud, Ana (36801939700); Mascarenhas, Yvonne P. (7003310927); Delerue-Matos, Cristina (6603741848); Borges, Tatiana (56465595400); Joanitti, Graziella A. (14060375800); Arcanjo, Daniel (47861880200); Kato, Massuo J. (7406306098); Kuckelhaus, Selma A. S. (8313515500); Silva, Marcos P. N. (56084795500); de Moraes, Josué (35763592900); Leite, José Roberto S. A. (7201818325)","55204819300; 56403199900; 57055189300; 57202609898; 55308326300; 55232677900; 57186187900; 55440133800; 8780177200; 36801939700; 7003310927; 6603741848; 56465595400; 14060375800; 47861880200; 7406306098; 8313515500; 56084795500; 35763592900; 7201818325","Structure–Activity relationship of piplartine and synthetic analogues against schistosoma mansoni and cytotoxicity to mammalian cells","2018","International Journal of Molecular Sciences","19","6","1802","","","","13","10.3390/ijms19061802","https://www.scopus.com/inward/record.uri?eid=2-s2.0-85048894479&doi=10.3390%2fijms19061802&partnerID=40&md5=8959c728f600d4ee38b0d761036935cd","Schistosomiasis, caused by helminth flatworms of the genus Schistosoma, is an infectious disease mainly associated with poverty that affects millions of people worldwide. Since treatment for this disease relies only on the use of praziquantel, there is an urgent need to identify new antischistosomal drugs. Piplartine is an amide alkaloid found in several Piper species (Piperaceae) that exhibits antischistosomal properties. The aim of this study was to evaluate the structure–function relationship between piplartine and its five synthetic analogues (19A, 1G, 1M, 14B and 6B) against Schistosoma mansoni adult worms, as well as its cytotoxicity to mammalian cells using murine fibroblast (NIH-3T3) and BALB/cN macrophage (J774A.1) cell lines. In addition, density functional theory calculations and in silico analysis were used to predict physicochemical and toxicity parameters. Bioassays revealed that piplartine is active against S. mansoni at low concentrations (5–10 µM), but its analogues did not. In contrast, based on 3-(4,5-dimethylthiazol-2-yl)-2,5-diphenyltetrazolium bromide (MTT) and flow cytometry assays, piplartine exhibited toxicity in mammalian cells at 785 µM, while its analogues 19A and 6B did not reduce cell viability at the same concentrations. This study demonstrated that piplartine analogues showed less activity against S. mansoni but presented lower toxicity than piplartine. © 2018 by the authors. Licensee MDPI, Basel, Switzerland.","Analogues; Cytotoxicity; Piplartine; Schistosoma mansoni","3T3 Cells; Animals; Anthelmintics; Cricetinae; Fibroblasts; Macrophages; Mice; Mice, Inbred BALB C; Piper; Piperidones; Plant Extracts; Quantitative Structure-Activity Relationship; Schistosoma mansoni; Snails; alkaloid derivative; antischistosomal agent; piplartine; praziquantel; unclassified drug; anthelmintic agent; piperidone derivative; piplartine; plant extract; adult; animal cell; antimicrobial activity; Article; cell death; cell viability; computer model; controlled study; cytolysis assay; cytotoxicity; cytotoxicity assay; female; flow cytometry; human; human cell; infrared spectroscopy; male; MTT assay; nonhuman; physical chemistry; Piper (plant); piper tuberculatum; proton nuclear magnetic resonance; reversed phase high performance liquid chromatography; Schistosoma mansoni; schistosomiasis; structure activity relation; ultraviolet visible spectrophotometry; 3T3 cell line; animal; Bagg albino mouse; chemistry; drug effect; fibroblast; hamster; macrophage; mouse; quantitative structure activity relation; snail","Article","Final","All Open Access; Gold Open Access","Scopus","2-s2.0-85048894479"
